PG,One Procter & Gamble Plaza,Cincinnati,OH,45202,United States,513 983 1100,https://www.pginvestor.com,Household & Personal Products,household-personal-products,Household & Personal Products,Consumer Defensive,consumer-defensive,Consumer Defensive,"The Procter & Gamble Company provides branded consumer packaged goods worldwide. It operates through five segments: Beauty; Grooming; Health Care; Fabric & Home Care; and Baby, Feminine & Family Care. The Beauty segment offers conditioners, shampoos, styling aids, and treatments under the Head & Shoulders, Herbal Essences, Pantene, and Rejoice brands; and antiperspirants and deodorants, personal cleansing, and skin care products under the Olay, Old Spice, Safeguard, Secret, and SK-II brands. The Grooming segment provides shave care products and appliances under the Braun, Gillette, and Venus brand names. The Health Care segment offers toothbrushes, toothpastes, and other oral care products under the Crest and Oral-B brand names; and gastrointestinal, rapid diagnostics, respiratory, vitamins/minerals/supplements, pain relief, and other personal health care products under the Metamucil, Neurobion, Pepto-Bismol, and Vicks brands. The Fabric & Home Care segment provides fabric enhancers, laundry additives, and laundry detergents under the Ariel, Downy, Gain, and Tide brands; and air care, dish care, P&G professional, and surface care products under the Cascade, Dawn, Fairy, Febreze, Mr. Clean, and Swiffer brands. The Baby, Feminine & Family Care segment offers baby wipes, taped diapers, and pants under the Luvs and Pampers brands; adult incontinence and feminine care products under the Always, Always Discreet, and Tampax brands; and paper towels, tissues, and toilet papers under the Bounty, Charmin, and Puffs brands. The company sells its products primarily through mass merchandisers, e-commerce, grocery stores, membership club stores, drug stores, department stores, distributors, wholesalers, specialty beauty stores, high-frequency stores, pharmacies, electronics stores, and professional channels, as well as directly to consumers. The Procter & Gamble Company was founded in 1837 and is headquartered in Cincinnati, Ohio.",107000.0,"[{'maxAge': 1, 'name': 'Mr. Jon R. Moeller', 'age': 58, 'title': 'President, CEO & Chairman of the Board', 'yearBorn': 1964, 'fiscalYear': 2023, 'totalPay': 6718062, 'exercisedValue': 11523920, 'unexercisedValue': 15191089}, {'maxAge': 1, 'name': 'Mr. Andre  Schulten', 'age': 51, 'title': 'Chief Financial Officer', 'yearBorn': 1971, 'fiscalYear': 2023, 'totalPay': 2548841, 'exercisedValue': 1319224, 'unexercisedValue': 7077850}, {'maxAge': 1, 'name': 'Mr. Shailesh G. Jejurikar', 'age': 55, 'title': 'Chief Operating Officer', 'yearBorn': 1967, 'fiscalYear': 2023, 'totalPay': 3044239, 'exercisedValue': 2347940, 'unexercisedValue': 25525736}, {'maxAge': 1, 'name': 'Ms. R. Alexandra Keith', 'age': 54, 'title': 'Chief Executive Officer of Beauty & Executive Sponsor of Corporate Sustainability', 'yearBorn': 1968, 'fiscalYear': 2023, 'totalPay': 2555599, 'exercisedValue': 1847665, 'unexercisedValue': 2125512}, {'maxAge': 1, 'name': 'Ms. Ma. Fatima de Vera Francisco', 'age': 54, 'title': 'Chief Executive Officer of Baby, Feminine & Family Care and Executive Sponsor for Gender Equality', 'yearBorn': 1968, 'fiscalYear': 2023, 'totalPay': 2744506, 'exercisedValue': 5175992, 'unexercisedValue': 21442908}, {'maxAge': 1, 'name': 'Mr. Matthew W. Janzaruk', 'age': 48, 'title': 'Senior VP & Chief Accounting Officer', 'yearBorn': 1974, 'fiscalYear': 2023, 'exercisedValue': 0, 'unexercisedValue': 0}, {'maxAge': 1, 'name': 'Mr. Vittorio  Cretella', 'title': 'Chief Information Officer', 'fiscalYear': 2023, 'exercisedValue': 0, 'unexercisedValue': 0}, {'maxAge': 1, 'name': 'Mr. John T. Chevalier', 'title': 'Senior Vice President of Investor Relations', 'fiscalYear': 2023, 'exercisedValue': 0, 'unexercisedValue': 0}, {'maxAge': 1, 'name': 'Ms. Susan Street Whaley', 'age': 48, 'title': 'Chief Legal Officer & Secretary', 'yearBorn': 1974, 'fiscalYear': 2023, 'exercisedValue': 0, 'unexercisedValue': 0}, {'maxAge': 1, 'name': 'Mr. Ken  Patel', 'title': 'Chief Ethics & Compliance Officer and Chief Patent Counsel', 'fiscalYear': 2023, 'exercisedValue': 0, 'unexercisedValue': 0}]",8.0,5.0,1.0,5.0,3.0,1696118400.0,1703980800.0,86400,2,144.78,145.14,142.56,145.56,144.78,145.14,142.56,145.56,3.76,0.026300002,1697673600.0,0.62380004,2.49,0.465,20.784883,5457698,5457698,5398862,5659620,5659620,0.0,0.0,800,800,337035296768,122.92,158.38,4.1098857,151.8812,148.74475,3.681,0.025424782,USD,365379780608.0,0.17868,2354783869.0,2356890112.0,14028852.0,14871633.0,1693440000.0,1695945600.0,0.006,0.00113,0.66119003,2.74,0.006,2356890112.0,19.456,7.349918,1688083200.0,1719705600.0,1688083200.0,14371000320.0,5.91,6.88,2:1,1087776000.0,4.456,16.783,0.13213527,0.19265866,0.941,1689811200.0,NYQ,EQUITY,PG,Procter & Gamble Company (The),The Procter & Gamble Company,-252322200,America/New_York,EDT,49f38fe0-3598-34d6-bf4a-0a8791c9c8b9,finmb_33328,-14400000,143.0,buy,8246000128.0,3.498,21770999808.0,35424002048.0,0.384,0.633,82005999616.0,75.266,34.628,0.10007,0.31384,39246000000.0,12746125312.0,16848000000.0,0.053,0.48053002,0.26548,0.23461,USD,3.2969,24.196278,0.109,2.99,179.0,135.0,166.09,168.5,2.3,22.0,0.129,,
TRV,485 Lexington Avenue,New York,NY,10017,United States,917 778 6000,https://www.travelers.com,Insurance - Property & Casualty,insurance-property-casualty,Insurance - Property & Casualty,Financial Services,financial-services,Financial Services,"The Travelers Companies, Inc., through its subsidiaries, provides a range of commercial and personal property, and casualty insurance products and services to businesses, government units, associations, and individuals in the United States and internationally. It operates through three segments: Business Insurance, Bond & Specialty Insurance, and Personal Insurance. The Business Insurance segment offers workers' compensation, commercial automobile and property, general liability, commercial multi-peril, employers' liability, public and product liability, professional indemnity, marine, aviation, onshore and offshore energy, construction, terrorism, personal accident, and kidnap and ransom insurance products. This segment operates through select accounts, which serve small businesses; commercial accounts that serve mid-sized businesses; national accounts, which serve large companies; and national property and other that serve large and mid-sized customers, commercial trucking industry, and agricultural businesses, as well as markets and distributes its products through brokers, wholesale agents, and program managers. The Bond & Specialty Insurance segment provides surety, fidelity, management and professional liability, and other property and casualty coverages and related risk management services through independent agencies and brokers. The Personal Insurance segment offers property and casualty insurance covering personal risks, primarily automobile and homeowners' insurance to individuals through independent agencies and brokers. The Travelers Companies, Inc. was founded in 1853 and is based in New York, New York.",31850.0,"[{'maxAge': 1, 'name': 'Mr. Alan David Schnitzer', 'age': 56, 'title': 'Chairman & CEO', 'yearBorn': 1966, 'fiscalYear': 2022, 'totalPay': 8173041, 'exercisedValue': 4286039, 'unexercisedValue': 48459016}, {'maxAge': 1, 'name': 'Mr. Daniel Stephen Frey', 'age': 57, 'title': 'Executive VP & CFO', 'yearBorn': 1965, 'fiscalYear': 2022, 'totalPay': 3195484, 'exercisedValue': 976865, 'unexercisedValue': 2461975}, {'maxAge': 1, 'name': 'Mr. Avrohom J. Kess', 'age': 53, 'title': 'Vice Chairman & Chief Legal Officer for Travelers', 'yearBorn': 1969, 'fiscalYear': 2022, 'totalPay': 4070028, 'exercisedValue': 0, 'unexercisedValue': 12295314}, {'maxAge': 1, 'name': 'Mr. Michael Frederick Klein', 'age': 54, 'title': 'Executive VP & President of Personal Insurance', 'yearBorn': 1968, 'fiscalYear': 2022, 'totalPay': 3308542, 'exercisedValue': 3418833, 'unexercisedValue': 5977856}, {'maxAge': 1, 'name': 'Mr. Gregory Cheshire Toczydlowski', 'age': 55, 'title': 'Executive VP & President of Business Insurance', 'yearBorn': 1967, 'fiscalYear': 2022, 'totalPay': 3687251, 'exercisedValue': 2830290, 'unexercisedValue': 7360915}, {'maxAge': 1, 'name': 'Ms. Mojgan Mehdian Lefebvre', 'age': 56, 'title': 'Executive VP, Chief Technology & Operations Officer', 'yearBorn': 1966, 'fiscalYear': 2022, 'exercisedValue': 0, 'unexercisedValue': 0}, {'maxAge': 1, 'name': 'Mr. David Donnay Rowland CFA', 'age': 56, 'title': 'Executive VP & Co-Chief Investment Officer', 'yearBorn': 1966, 'fiscalYear': 2022, 'exercisedValue': 0, 'unexercisedValue': 0}, {'maxAge': 1, 'name': 'Mr. Daniel Tei-Hwa Yin', 'age': 56, 'title': 'Executive VP & Co-Chief Investment Officer', 'yearBorn': 1966, 'fiscalYear': 2022, 'exercisedValue': 0, 'unexercisedValue': 0}, {'maxAge': 1, 'name': 'Mr. Paul Edward Munson', 'age': 56, 'title': 'Senior VP of Finance, Corporate Controller & Principal Accounting Officer', 'yearBorn': 1966, 'fiscalYear': 2022, 'exercisedValue': 0, 'unexercisedValue': 0}, {'maxAge': 1, 'name': 'Mr. Andy Francis Bessette', 'age': 68, 'title': 'Executive VP & Chief Administrative Officer', 'yearBorn': 1954, 'fiscalYear': 2022, 'exercisedValue': 0, 'unexercisedValue': 0}]",8.0,8.0,8.0,1.0,5.0,1696118400.0,1672444800.0,86400,2,162.23,162.2,161.09,162.92,162.23,162.2,161.09,162.92,4.0,0.024600001,1694044800.0,0.4019,2.33,0.6,9.447935,851353,851353,1205220,1183440,1183440,0.0,0.0,900,800,37182472192,155.72,194.51,0.95977056,164.32,174.8813,3.79,0.023361893,USD,40716521472.0,0.05767,227955587.0,228942000.0,3270192.0,2520003.0,1693440000.0,1695945600.0,0.0143,0.00238,0.84234,2.86,0.0143,228942000.0,95.478,1.7010202,1672444800.0,1703980800.0,1688083200.0,2217999872.0,9.44,17.19,2:1,894931200.0,1.051,11.58,-0.018729985,0.19265866,1.0,1694044800.0,NYQ,EQUITY,TRV,"The Travelers Companies, Inc.","The Travelers Companies, Inc.",185466600,America/New_York,EDT,f9648b70-41f5-3bd8-a005-3a20a688b790,finmb_392856,-14400000,162.41,hold,4496999936.0,19.643,3516000000.0,8031000064.0,0.182,0.331,38741000192.0,36.747,166.664,0.0145000005,0.09989,8515000000.0,12497874944.0,6384999936.0,0.105,0.19931999,0.09076,0.0043599997,USD,0.5897,17.20445,,0.96,230.0,166.0,191.67,185.5,2.7,18.0,,,
UNH,UnitedHealth Group Center,Minnetonka,MN,55343,United States,952 936 1300,https://www.unitedhealthgroup.com,Healthcare Plans,healthcare-plans,Healthcare Plans,Healthcare,healthcare,Healthcare,"UnitedHealth Group Incorporated operates as a diversified health care company in the United States. It operates through four segments: UnitedHealthcare, Optum Health, Optum Insight, and Optum Rx. The UnitedHealthcare segment offers consumer-oriented health benefit plans and services for national employers, public sector employers, mid-sized employers, small businesses, and individuals; health care coverage, and health and well-being services to individuals age 50 and older addressing their needs; Medicaid plans, children's health insurance and health care programs; and health and dental benefits, and hospital and clinical services, as well as health care benefits products and services to state programs caring for the economically disadvantaged, medically underserved, and  those without the benefit of employer-funded health care coverage. The OptumHealth segment provides care delivery, care management, wellness and consumer engagement, and health financial services for consumers, care delivery systems, providers, employers, payers, and public-sector entities. The OptumInsight segment offers software and information products, advisory consulting arrangements, and managed services outsourcing contracts to hospital systems, physicians, health plans, governments, life sciences companies, and other organizations. The OptumRx segment provides pharmacy care services and programs, including retail network contracting, home delivery, specialty and community health pharmacy services, and purchasing and clinical capabilities, as well as develops programs in the areas of step therapy, formulary management, drug adherence, and disease/drug therapy management. UnitedHealth Group Incorporated was incorporated in 1977 and is based in Minnetonka, Minnesota.",400000.0,"[{'maxAge': 1, 'name': 'Sir Andrew Philip Witty', 'age': 57, 'title': 'CEO & Non-Independent Director', 'yearBorn': 1965, 'fiscalYear': 2022, 'totalPay': 4364334, 'exercisedValue': 0, 'unexercisedValue': 25645708}, {'maxAge': 1, 'name': 'Mr. Dirk C. McMahon', 'age': 62, 'title': 'President & COO', 'yearBorn': 1960, 'fiscalYear': 2022, 'totalPay': 3432099, 'exercisedValue': 0, 'unexercisedValue': 65918272}, {'maxAge': 1, 'name': 'Mr. John F. Rex', 'age': 60, 'title': 'Executive VP & CFO', 'yearBorn': 1962, 'fiscalYear': 2022, 'totalPay': 3432099, 'exercisedValue': 20996852, 'unexercisedValue': 85664928}, {'maxAge': 1, 'name': 'Mr. Rupert  Bondy', 'age': 60, 'title': 'Executive VP, Chief Legal Officer & Corporate Secretary', 'yearBorn': 1962, 'fiscalYear': 2022, 'totalPay': 4315947, 'exercisedValue': 0, 'unexercisedValue': 0}, {'maxAge': 1, 'name': 'Mr. Brian Robert Thompson', 'title': 'Executive VP & CEO of UnitedHealthcare', 'fiscalYear': 2022, 'totalPay': 2859184, 'exercisedValue': 0, 'unexercisedValue': 18846174}, {'maxAge': 1, 'name': 'Mr. Thomas Edward Roos', 'age': 49, 'title': 'Senior VP & Chief Accounting Officer', 'yearBorn': 1973, 'fiscalYear': 2022, 'exercisedValue': 0, 'unexercisedValue': 0}, {'maxAge': 1, 'name': 'Mr. Sandeep  Dadlani', 'age': 47, 'title': 'Executive VP and Chief Digital & Technology Officer', 'yearBorn': 1975, 'fiscalYear': 2022, 'exercisedValue': 0, 'unexercisedValue': 0}, {'maxAge': 1, 'name': 'Mr. Zachary William Sopcak', 'title': 'Senior Vice President of Capital Markets Communications & Investor Relations', 'fiscalYear': 2022, 'exercisedValue': 0, 'unexercisedValue': 0}, {'maxAge': 1, 'name': 'Ms. Jennifer Mound Smoter', 'title': 'Senior VP & Chief Communications Officer', 'fiscalYear': 2022, 'exercisedValue': 0, 'unexercisedValue': 0}, {'maxAge': 1, 'name': 'Mr. James T. Barry Jr.', 'age': 76, 'title': 'Director of Sales for Western Pennsylvania', 'yearBorn': 1946, 'fiscalYear': 2022, 'exercisedValue': 0, 'unexercisedValue': 0}]",10.0,4.0,5.0,1.0,3.0,1696118400.0,1672444800.0,86400,2,524.24,520.92,520.23,525.59,524.24,520.92,520.23,525.59,7.06,0.0135,1694131200.0,0.3057,1.36,0.649,18.806242,2818789,2818789,3063292,2947630,2947630,0.0,0.0,1000,1000,485504253952,445.68,558.1,1.3930656,498.4896,490.2178,6.83,0.013028384,USD,514617311232.0,0.06057,922803706.0,926305024.0,5860745.0,5203501.0,1693440000.0,1695945600.0,0.0063,0.00271,0.88991,1.94,0.0063,926305024.0,88.838,5.8998404,1672444800.0,1703980800.0,1688083200.0,21108000768.0,22.33,27.87,2:1,1117497600.0,1.477,15.455,0.027887225,0.19265866,1.88,1694131200.0,NYQ,EQUITY,UNH,UnitedHealth Group Incorporated,UnitedHealth Group Incorporated,466867800,America/New_York,EDT,33ae4437-560d-3a42-9aa4-234d48c993c5,finmb_104673,-14400000,524.13,buy,46279000064.0,49.961,33297000448.0,65588998144.0,0.711,0.763,348515008512.0,71.172,373.542,0.0747,0.25072,79617000000.0,37821251584.0,41374998528.0,0.156,0.24791999,0.09554,0.08672,USD,1.4872,23.472012,0.08,1.66,650.0,520.0,570.87,561.0,1.8,23.0,0.09,,9900 Bren Road East
RTX,1000 Wilson Boulevard,Arlington,VA,22209,United States,781 522 3000,https://www.rtx.com,Aerospace & Defense,aerospace-defense,Aerospace & Defense,Industrials,industrials,Industrials,"RTX Corporation, an aerospace and defense company, provides systems and services for the commercial, military, and government customers worldwide. It operates through four segments: Collins Aerospace, Pratt & Whitney, Raytheon Intelligence & Space, and Raytheon Missiles & Defense. The Collins Aerospace Systems segment offers aerospace and defense products, and aftermarket service solutions for aircraft manufacturers and airlines, as well as regional, business, and general aviation; and for defense and commercial space operations. This segment also designs, produces, and supports cabin interior, oxygen systems, food and beverage preparation, storage and galley systems, and lavatory and wastewater management systems; airborne intelligence, surveillance and reconnaissance systems, test and training range systems, crew escape systems, and simulation and training solutions; information management services; and aftermarket services that include spare parts, overhaul and repair, engineering and technical support, training and fleet management solutions, and asset management services. The Pratt & Whitney segment supplies aircraft engines for commercial, military, business jet, and general aviation customers; and produces, sells, and services military and commercial auxiliary power units. The Raytheon Intelligence & Space segment develops and provides integrated space, communication, and sensor systems, and cyber and software solutions to intelligence, defense, federal, and commercial customers. The Raytheon Missiles & Defense segment provides end-to-end solutions for U.S. and foreign government customers designed to detect, track, and engage threats. The company was formerly known as Raytheon Technologies Corporation and changed its name to RTX Corporation in July 2023. RTX Corporation was incorporated in 1934 and is headquartered in Arlington, Virginia.",182000.0,"[{'maxAge': 1, 'name': 'Mr. Gregory J. Hayes', 'age': 61, 'title': 'CEO & Chairman', 'yearBorn': 1961, 'fiscalYear': 2022, 'totalPay': 6821349, 'exercisedValue': 952016, 'unexercisedValue': 33913520}, {'maxAge': 1, 'name': 'Mr. Christopher T. Calio', 'age': 48, 'title': 'Pres & COO', 'yearBorn': 1974, 'fiscalYear': 2022, 'totalPay': 2758460, 'exercisedValue': 159925, 'unexercisedValue': 3028470}, {'maxAge': 1, 'name': 'Mr. Neil G. Mitchill Jr.', 'age': 46, 'title': 'Chief Financial Officer', 'yearBorn': 1976, 'fiscalYear': 2022, 'totalPay': 2304639, 'exercisedValue': 0, 'unexercisedValue': 2614488}, {'maxAge': 1, 'name': 'Mr. Stephen J. Timm', 'age': 53, 'title': 'Pres of Collins Aerospace Systems', 'yearBorn': 1969, 'fiscalYear': 2022, 'totalPay': 1888193, 'exercisedValue': 0, 'unexercisedValue': 699121}, {'maxAge': 1, 'name': 'Mr. Wesley D. Kremer', 'age': 57, 'title': 'Pres of Raytheon', 'yearBorn': 1965, 'fiscalYear': 2022, 'totalPay': 1708553, 'exercisedValue': 0, 'unexercisedValue': 0}, {'maxAge': 1, 'name': 'Ms. Robin L. Diamonte', 'age': 57, 'title': 'Chief Investment Officer & VP of Pension Investments', 'yearBorn': 1965, 'exercisedValue': 0, 'unexercisedValue': 0}, {'maxAge': 1, 'name': 'Ms. Amy L. Johnson', 'age': 47, 'title': 'Corp. VP & Controller', 'yearBorn': 1975, 'exercisedValue': 0, 'unexercisedValue': 0}, {'maxAge': 1, 'name': 'Mr. Mark E. Russell', 'age': 60, 'title': 'Chief Technology Officer', 'yearBorn': 1962, 'exercisedValue': 0, 'unexercisedValue': 0}, {'maxAge': 1, 'name': 'Ms. Jennifer  Reed', 'title': 'VP of Investor Relations', 'exercisedValue': 0, 'unexercisedValue': 0}, {'maxAge': 1, 'name': 'Mr. Ramsaran  Maharajh Jr.', 'age': 50, 'title': 'Gen. Counsel', 'yearBorn': 1972, 'exercisedValue': 0, 'unexercisedValue': 0}]",6.0,5.0,5.0,2.0,3.0,1696118400.0,1672444800.0,86400,2,73.35,73.33,72.62,73.33,73.35,73.33,72.62,73.33,2.36,0.0322,1692230400.0,0.59419996,2.57,0.733494,13.137993,7338154,7338154,8588935,8772760,8772760,0.0,0.0,1000,1000,106703437824,68.56,104.91,1.5119584,79.771,93.2168,2.24,0.030538514,USD,140046630912.0,0.07881,1330537175.0,1455510016.0,7672736.0,8709545.0,1693440000.0,1695945600.0,0.0053,0.00088,0.80918,0.78,0.0053,1455510016.0,49.729,1.4741901,1672444800.0,1703980800.0,1688083200.0,5561999872.0,3.77,5.58,15890:10000,1585872000.0,1.984,11.586,-0.1362083,0.19265866,0.59,1692230400.0,NYQ,EQUITY,RTX,RTX Corporation,RTX Corporation,-244546200,America/New_York,EDT,ffd67fad-fdd4-3389-b63e-d608af877db5,finmb_159230,-14400000,73.31,hold,5391000064.0,3.699,12088000512.0,36922998784.0,0.677,1.099,70572998656.0,49.837,48.206,0.0308,0.07806,13668000000.0,3304250112.0,5262000128.0,0.123,0.20433001,0.17128,0.11215,USD,4.2608,19.445623,0.018,1.3,110.0,70.0,87.76,83.0,2.6,21.0,0.023,,
VZ,1095 Avenue of the Americas,New York,NY,10036,United States,212 395 1000,https://www.verizon.com,Telecom Services,telecom-services,Telecom Services,Communication Services,communication-services,Communication Services,"Verizon Communications Inc., through its subsidiaries, provides communications, technology, information, and entertainment products and services to consumers, businesses, and governmental entities worldwide. It operates in two segments, Verizon Consumer Group (Consumer) and Verizon Business Group (Business). The Consumer segment provides wireless services across the wireless networks in the United States under the Verizon and TracFone brands and through wholesale and other arrangements; and fixed wireless access (FWA) broadband through its wireless networks. It also offers wireline services in the Mid-Atlantic and Northeastern United States, as well as Washington D.C. through its fiber-optic network, Verizon Fios product portfolio, and a copper-based network. The Business segment provides wireless and wireline communications services and products, including data, video, conferencing, corporate networking, security and managed network, local and long-distance voice, network access, and various IoT services and products, as well as FWA broadband through its wireless networks. The company was formerly known as Bell Atlantic Corporation and changed its name to Verizon Communications Inc. in June 2000. Verizon Communications Inc. was incorporated in 1983 and is headquartered in New York, New York.",117100.0,"[{'maxAge': 1, 'name': 'Mr. Hans E. Vestberg', 'age': 57, 'title': 'Chairman & CEO', 'yearBorn': 1965, 'fiscalYear': 2022, 'totalPay': 5332693, 'exercisedValue': 0, 'unexercisedValue': 0}, {'maxAge': 1, 'name': 'Mr. Craig L. Silliman', 'age': 54, 'title': 'Executive VP & President of Verizon Global Services', 'yearBorn': 1968, 'fiscalYear': 2022, 'totalPay': 2134399, 'exercisedValue': 0, 'unexercisedValue': 0}, {'maxAge': 1, 'name': 'Mr. Kyle  Malady', 'age': 54, 'title': 'Executive VP & CEO of Verizon Business Group', 'yearBorn': 1968, 'fiscalYear': 2022, 'totalPay': 6613565, 'exercisedValue': 0, 'unexercisedValue': 0}, {'maxAge': 1, 'name': 'Mr. Sowmyanarayan  Sampath', 'age': 45, 'title': 'Executive VP & CEO of Verizon Consumer Group', 'yearBorn': 1977, 'fiscalYear': 2022, 'totalPay': 1754076, 'exercisedValue': 0, 'unexercisedValue': 0}, {'maxAge': 1, 'name': 'Mr. Anthony T. Skiadas', 'age': 53, 'title': 'Executive VP & CFO', 'yearBorn': 1969, 'fiscalYear': 2022, 'exercisedValue': 0, 'unexercisedValue': 0}, {'maxAge': 1, 'name': 'Ms. Mary-Lee  Stillwell', 'age': 48, 'title': 'Senior VP of Accounting & External Reporting and Controller', 'yearBorn': 1974, 'fiscalYear': 2022, 'exercisedValue': 0, 'unexercisedValue': 0}, {'maxAge': 1, 'name': 'Mr. Joseph J. Russo', 'title': 'Executive VP & President of Global Networks and Technology', 'fiscalYear': 2022, 'exercisedValue': 0, 'unexercisedValue': 0}, {'maxAge': 1, 'name': 'Mr. Brady  Connor', 'title': 'Senior Vice President of Investor Relations', 'fiscalYear': 2022, 'exercisedValue': 0, 'unexercisedValue': 0}, {'maxAge': 1, 'name': 'Ms. Vandana  Venkatesh', 'age': 50, 'title': 'Executive VP & Chief Legal Officer', 'yearBorn': 1972, 'fiscalYear': 2022, 'exercisedValue': 0, 'unexercisedValue': 0}, {'maxAge': 1, 'name': 'Mr. James J. Gerace', 'age': 58, 'title': 'Senior VP & Chief Communications Officer', 'yearBorn': 1964, 'fiscalYear': 2022, 'exercisedValue': 0, 'unexercisedValue': 0}]",1.0,7.0,2.0,3.0,1.0,1696118400.0,1672444800.0,86400,2,31.76,31.83,31.4101,31.97,31.76,31.83,31.4101,31.97,2.66,0.0846,1696809600.0,0.522,5.01,0.391,6.707889,15672892,15672892,25059846,21757060,21757060,0.0,0.0,4000,900,132259094528,30.14,42.58,0.979697,33.14,36.5815,2.61,0.08217884,USD,310950100992.0,0.15581,4200802874.0,4204039936.0,37285702.0,42561388.0,1693440000.0,1695945600.0,0.0089,0.00033,0.63936,1.74,0.0089,4204039936.0,22.643,1.3893919,1672444800.0,1703980800.0,1688083200.0,21034000384.0,5.0,4.69,1000000:937889,1278028800.0,2.303,6.491,-0.13571429,0.19265866,0.665,1696550400.0,NYQ,EQUITY,VZ,Verizon Communications Inc.,Verizon Communications Inc.,438273000,America/New_York,EDT,a708480c-0400-3ea0-b2d3-ca752db5c3b1,finmb_415798,-14400000,31.46,hold,4920000000.0,1.17,47907999744.0,182301999104.0,0.557,0.727,134999998464.0,188.91,32.105,0.05114,0.23393999,77702000000.0,11474875392.0,37496000512.0,-0.035,0.58050996,0.35487,0.23,USD,6.044,6.292,-0.106,13.82,64.0,30.0,39.81,39.0,2.8,22.0,-0.111,,
