symbol,address1,city,state,zip,country,phone,website,industry,industryKey,industryDisp,sector,sectorKey,sectorDisp,longBusinessSummary,fullTimeEmployees,companyOfficers,auditRisk,boardRisk,compensationRisk,shareHolderRightsRisk,overallRisk,governanceEpochDate,compensationAsOfEpochDate,maxAge,priceHint,previousClose,open,dayLow,dayHigh,regularMarketPreviousClose,regularMarketOpen,regularMarketDayLow,regularMarketDayHigh,dividendRate,dividendYield,exDividendDate,payoutRatio,fiveYearAvgDividendYield,beta,forwardPE,volume,regularMarketVolume,averageVolume,averageVolume10days,averageDailyVolume10Day,bid,ask,bidSize,askSize,marketCap,fiftyTwoWeekLow,fiftyTwoWeekHigh,priceToSalesTrailing12Months,fiftyDayAverage,twoHundredDayAverage,trailingAnnualDividendRate,trailingAnnualDividendYield,currency,enterpriseValue,profitMargins,floatShares,sharesOutstanding,sharesShort,sharesShortPriorMonth,sharesShortPreviousMonthDate,dateShortInterest,sharesPercentSharesOut,heldPercentInsiders,heldPercentInstitutions,shortRatio,shortPercentOfFloat,impliedSharesOutstanding,bookValue,priceToBook,lastFiscalYearEnd,nextFiscalYearEnd,mostRecentQuarter,netIncomeToCommon,trailingEps,forwardEps,lastSplitFactor,lastSplitDate,enterpriseToRevenue,enterpriseToEbitda,52WeekChange,SandP52WeekChange,lastDividendValue,lastDividendDate,exchange,quoteType,underlyingSymbol,shortName,longName,firstTradeDateEpochUtc,timeZoneFullName,timeZoneShortName,uuid,messageBoardId,gmtOffSetMilliseconds,currentPrice,recommendationKey,totalCash,totalCashPerShare,ebitda,totalDebt,quickRatio,currentRatio,totalRevenue,debtToEquity,revenuePerShare,returnOnAssets,returnOnEquity,grossProfits,freeCashflow,operatingCashflow,revenueGrowth,grossMargins,ebitdaMargins,operatingMargins,financialCurrency,trailingPegRatio,trailingPE,earningsQuarterlyGrowth,pegRatio,targetHighPrice,targetLowPrice,targetMeanPrice,targetMedianPrice,recommendationMean,numberOfAnalystOpinions,earningsGrowth,fax,address2
MMM,3M Center,Saint Paul,MN,55144-1000,United States,651 733 1110,https://www.3m.com,Conglomerates,conglomerates,Conglomerates,Industrials,industrials,Industrials,"3M Company provides diversified technology services in the United States and internationally. The company operates through four segments: Safety and Industrial; Transportation and Electronics; Health Care; and Consumer. The Safety and Industrial segment offers industrial abrasives and finishing for metalworking applications; autobody repair solutions; closure systems for personal hygiene products, masking, and packaging materials; electrical products and materials for construction and maintenance, power distribution, and electrical original equipment manufacturers; structural adhesives and tapes; respiratory, hearing, eye, and fall protection solutions; and natural and color-coated mineral granules for shingles. The Transportation and Electronics segment provides ceramic solutions; attachment tapes, films, sound, and temperature management for transportation vehicles; premium large format graphic films for advertising and fleet signage; light management films and electronics assembly solutions; packaging and interconnection solutions; and reflective signage for highway, and vehicle safety. The Healthcare segment offers health care procedure coding and reimbursement software; skin, wound care, and infection prevention products and solutions; dentistry and orthodontia solutions; and filtration and purification systems. The Consumer segment provides consumer bandages, braces, supports, and consumer respirators; cleaning products for the home; retail abrasives, paint accessories, car care DIY products, picture hanging, and consumer air quality solutions; and stationery products. It offers its products through e-commerce and traditional wholesalers, retailers, jobbers, distributors, and dealers. 3M Company was founded in 1902 and is headquartered in St. Paul, Minnesota.",92000.0,"[{'maxAge': 1, 'name': 'Mr. Michael F. Roman', 'age': 62, 'title': 'Chairman & CEO', 'yearBorn': 1960, 'fiscalYear': 2022, 'totalPay': 3030438, 'exercisedValue': 474479, 'unexercisedValue': 0}, {'maxAge': 1, 'name': 'Mr. Monish D. Patolawala', 'age': 50, 'title': 'Executive VP & CFO', 'yearBorn': 1972, 'fiscalYear': 2022, 'totalPay': 2086773, 'exercisedValue': 0, 'unexercisedValue': 0}, {'maxAge': 1, 'name': 'Mr. Jeffrey R. Lavers', 'age': 58, 'title': 'Group President of Health Care', 'yearBorn': 1964, 'fiscalYear': 2022, 'totalPay': 1097614, 'exercisedValue': 0, 'unexercisedValue': 0}, {'maxAge': 1, 'name': 'Mr. Peter D. Gibbons', 'age': 61, 'title': 'Group President of Enterprise Operations', 'yearBorn': 1961, 'fiscalYear': 2022, 'totalPay': 1333946, 'exercisedValue': 0, 'unexercisedValue': 0}, {'maxAge': 1, 'name': 'Ms. Theresa E. Reinseth', 'age': 49, 'title': 'Senior VP, Corporate Controller & Chief Accounting Officer', 'yearBorn': 1973, 'fiscalYear': 2022, 'exercisedValue': 0, 'unexercisedValue': 0}, {'maxAge': 1, 'name': 'Dr. John P. Banovetz', 'age': 54, 'title': 'Executive VP, CTO & Environmental Responsibility', 'yearBorn': 1968, 'fiscalYear': 2022, 'exercisedValue': 0, 'unexercisedValue': 0}, {'maxAge': 1, 'name': 'Mr. Mark W. Murphy II', 'age': 54, 'title': 'Executive VP and Chief Information & Digital Officer', 'yearBorn': 1968, 'fiscalYear': 2022, 'exercisedValue': 0, 'unexercisedValue': 0}, {'maxAge': 1, 'name': 'Mr. Bruce  Jermeland C.F.A.', 'title': 'Vice President of Investor Relations', 'fiscalYear': 2022, 'exercisedValue': 0, 'unexercisedValue': 0}, {'maxAge': 1, 'name': 'Michael A. Duran', 'title': 'Senior VP and Chief Ethics & Compliance Officer', 'fiscalYear': 2022, 'exercisedValue': 0, 'unexercisedValue': 0}, {'maxAge': 1, 'name': 'Mr. Kevin H. Rhodes', 'age': 59, 'title': 'Executive VP & Chief Legal Affairs Officer', 'yearBorn': 1963, 'fiscalYear': 2022, 'exercisedValue': 0, 'unexercisedValue': 0}]",9.0,7.0,7.0,4.0,7.0,1696118400.0,1672444800.0,86400,2,90.64,90.8,89.75,90.98,90.64,90.8,89.75,90.98,6.0,0.0664,1692316800.0,0.6167,3.89,0.982,9.366839,2119508,2119508,3697956,4474340,4474340,0.0,0.0,1000,800,49894555648,86.33,133.91,1.5094862,99.8974,105.36965,5.98,0.065975286,USD,62539595776.0,-0.044320002,551495637.0,551992000.0,11116303.0,11899822.0,1693440000.0,1695945600.0,0.0201,0.00125,0.67402,2.83,0.0202,551992000.0,14.127,6.398386,1672444800.0,1703980800.0,1688083200.0,-1464999936.0,-2.82,9.65,2:1,1064880000.0,1.892,8.373,-0.20890951,0.19265866,1.5,1692316800.0,NYQ,EQUITY,MMM,3M Company,3M Company,-252322200,America/New_York,EDT,375388b3-dab7-3763-90cd-457ad19388a2,finmb_289194,-14400000,90.39,none,4313999872.0,7.815,7469000192.0,16899999744.0,0.847,1.441,33053999104.0,215.095,59.359,0.074650005,-0.13371,15000000000.0,3877499904.0,6237000192.0,-0.043,0.44134,0.22596,0.20541,USD,3.5041,,,,,,,,,,,,
AXP,200 Vesey Street,New York,NY,10285,United States,212 640 2000,https://www.americanexpress.com,Credit Services,credit-services,Credit Services,Financial Services,financial-services,Financial Services,"American Express Company, together with its subsidiaries, provides charge and credit payment card products, and travel-related services worldwide. The company operates through three segments: Global Consumer Services Group, Global Commercial Services, and Global Merchant and Network Services. Its products and services include payment and financing products; network services; accounts payable expense management products and services; and travel and lifestyle services. The company's products and services also comprise merchant acquisition and processing, servicing and settlement, point-of-sale marketing, and information products and services for merchants; and fraud prevention services, as well as the design and operation of customer loyalty programs. It sells its products and services to consumers, small businesses, mid-sized companies, and large corporations through mobile and online applications, third-party vendors and business partners, direct mail, telephone, in-house sales teams, and direct response advertising. American Express Company was founded in 1850 and is headquartered in New York, New York.",77300.0,"[{'maxAge': 1, 'name': 'Mr. Stephen Joseph Squeri', 'age': 62, 'title': 'Chairman & CEO', 'yearBorn': 1960, 'fiscalYear': 2022, 'totalPay': 12391509, 'exercisedValue': 22554032, 'unexercisedValue': 8181222}, {'maxAge': 1, 'name': 'Mr. Ravikumar  Radhakrishnan', 'age': 50, 'title': 'Executive VP & CIO', 'yearBorn': 1972, 'fiscalYear': 2022, 'totalPay': 7427926, 'exercisedValue': 0, 'unexercisedValue': 0}, {'maxAge': 1, 'name': 'Mr. Anre D. Williams', 'age': 56, 'title': 'CEO of American Express National Bank & Group President of Enterprise Services', 'yearBorn': 1966, 'fiscalYear': 2022, 'totalPay': 7208480, 'exercisedValue': 14110758, 'unexercisedValue': 1641721}, {'maxAge': 1, 'name': 'Mr. Douglas E. Buckminster', 'age': 61, 'title': 'Vice Chairman', 'yearBorn': 1961, 'fiscalYear': 2022, 'totalPay': 8514716, 'exercisedValue': 1550017, 'unexercisedValue': 14540464}, {'maxAge': 1, 'name': 'Mr. Christophe  Le Caillec', 'age': 56, 'title': 'Chief Financial Officer', 'yearBorn': 1966, 'fiscalYear': 2022, 'exercisedValue': 0, 'unexercisedValue': 0}, {'maxAge': 1, 'name': 'Ms. Jessica  Lieberman Quinn', 'age': 49, 'title': 'Executive VP, Corporate Controller & Principal Accounting Officer', 'yearBorn': 1973, 'fiscalYear': 2022, 'exercisedValue': 0, 'unexercisedValue': 0}, {'maxAge': 1, 'name': 'Ms. Kerri S. Bernstein', 'title': 'Head of Investor Relations', 'fiscalYear': 2022, 'exercisedValue': 0, 'unexercisedValue': 0}, {'maxAge': 1, 'name': 'Ms. Laureen E. Seeger', 'age': 60, 'title': 'Chief Legal Officer', 'yearBorn': 1962, 'fiscalYear': 2022, 'totalPay': 5886810, 'exercisedValue': 1388148, 'unexercisedValue': 0}, {'maxAge': 1, 'name': 'Mr. David B. Nigro', 'age': 60, 'title': 'Chief Risk Officer & Head of Global Risk and Compliance', 'yearBorn': 1962, 'fiscalYear': 2022, 'exercisedValue': 0, 'unexercisedValue': 0}, {'maxAge': 1, 'name': 'Ms. Elizabeth  Rutledge', 'age': 60, 'title': 'Chief Marketing Officer', 'yearBorn': 1962, 'fiscalYear': 2022, 'exercisedValue': 0, 'unexercisedValue': 0}]",5.0,6.0,10.0,6.0,9.0,1696118400.0,1672444800.0,86400,2,150.93,151.425,149.76,152.81,150.93,151.425,149.76,152.81,2.4,0.015800001,1696464000.0,0.22760001,1.32,1.207,12.268015,1696772,1696772,2846400,3021330,3021330,0.0,0.0,800,800,111580897280,130.65,182.15,2.1049426,157.7204,162.5732,2.24,0.014841318,USD,118592880640.0,0.14037,583503729.0,736459008.0,6282419.0,6760424.0,1693440000.0,1695945600.0,0.0085,0.0014399999,0.86319,2.1,0.0108,736459008.0,36.281,4.176015,1672444800.0,1703980800.0,1688083200.0,7327000064.0,9.83,12.35,10000:8753,1128297600.0,2.237,,0.07036388,0.19265866,0.6,1696464000.0,NYQ,EQUITY,AXP,American Express Company,American Express Company,76253400,America/New_York,EDT,3b2d1661-0aa2-3fea-bdbf-6a46a3a4a87c,finmb_92001,-14400000,151.51,buy,41819000832.0,56.784,,48831000576.0,1.599,1.608,53008998400.0,182.867,71.249,0.03306,0.29801,28776000000.0,,16485999616.0,0.067,0.5557,0.0,0.19629999,USD,0.9315,15.413021,0.107,0.94,220.0,125.0,179.23,182.5,2.5,22.0,0.125,,
AAPL,One Apple Park Way,Cupertino,CA,95014,United States,408 996 1010,https://www.apple.com,Consumer Electronics,consumer-electronics,Consumer Electronics,Technology,technology,Technology,"Apple Inc. designs, manufactures, and markets smartphones, personal computers, tablets, wearables, and accessories worldwide. The company offers iPhone, a line of smartphones; Mac, a line of personal computers; iPad, a line of multi-purpose tablets; and wearables, home, and accessories comprising AirPods, Apple TV, Apple Watch, Beats products, and HomePod. It also provides AppleCare support and cloud services; and operates various platforms, including the App Store that allow customers to discover and download applications and digital content, such as books, music, video, games, and podcasts. In addition, the company offers various services, such as Apple Arcade, a game subscription service; Apple Fitness+, a personalized fitness service; Apple Music, which offers users a curated listening experience with on-demand radio stations; Apple News+, a subscription news and magazine service; Apple TV+, which offers exclusive original content; Apple Card, a co-branded credit card; and Apple Pay, a cashless payment service, as well as licenses its intellectual property. The company serves consumers, and small and mid-sized businesses; and the education, enterprise, and government markets. It distributes third-party applications for its products through the App Store. The company also sells its products through its retail and online stores, and direct sales force; and third-party cellular network carriers, wholesalers, retailers, and resellers. Apple Inc. was incorporated in 1977 and is headquartered in Cupertino, California.",164000.0,"[{'maxAge': 1, 'name': 'Mr. Timothy D. Cook', 'age': 61, 'title': 'CEO & Director', 'yearBorn': 1961, 'fiscalYear': 2022, 'totalPay': 16425933, 'exercisedValue': 0, 'unexercisedValue': 0}, {'maxAge': 1, 'name': 'Mr. Luca  Maestri', 'age': 59, 'title': 'CFO & Senior VP', 'yearBorn': 1963, 'fiscalYear': 2022, 'totalPay': 5019783, 'exercisedValue': 0, 'unexercisedValue': 0}, {'maxAge': 1, 'name': 'Mr. Jeffrey E. Williams', 'age': 58, 'title': 'Chief Operating Officer', 'yearBorn': 1964, 'fiscalYear': 2022, 'totalPay': 5018337, 'exercisedValue': 0, 'unexercisedValue': 0}, {'maxAge': 1, 'name': 'Ms. Katherine L. Adams', 'age': 58, 'title': 'Senior VP, General Counsel & Secretary', 'yearBorn': 1964, 'fiscalYear': 2022, 'totalPay': 5015208, 'exercisedValue': 0, 'unexercisedValue': 0}, {'maxAge': 1, 'name': ""Ms. Deirdre  O'Brien"", 'age': 55, 'title': 'Senior Vice President of Retail', 'yearBorn': 1967, 'fiscalYear': 2022, 'totalPay': 5019783, 'exercisedValue': 0, 'unexercisedValue': 0}, {'maxAge': 1, 'name': 'Mr. Chris  Kondo', 'title': 'Senior Director of Corporate Accounting', 'fiscalYear': 2022, 'exercisedValue': 0, 'unexercisedValue': 0}, {'maxAge': 1, 'name': 'Mr. James  Wilson', 'title': 'Chief Technology Officer', 'fiscalYear': 2022, 'exercisedValue': 0, 'unexercisedValue': 0}, {'maxAge': 1, 'name': 'Ms. Mary  Demby', 'title': 'Chief Information Officer', 'fiscalYear': 2022, 'exercisedValue': 0, 'unexercisedValue': 0}, {'maxAge': 1, 'name': 'Ms. Nancy  Paxton', 'title': 'Senior Director of Investor Relations & Treasury', 'fiscalYear': 2022, 'exercisedValue': 0, 'unexercisedValue': 0}, {'maxAge': 1, 'name': 'Mr. Greg  Joswiak', 'title': 'Senior Vice President of Worldwide Marketing', 'fiscalYear': 2022, 'exercisedValue': 0, 'unexercisedValue': 0}]",4.0,1.0,5.0,1.0,1.0,1696118400.0,1672444800.0,86400,2,178.39,178.2,177.6,179.85,178.39,178.2,177.6,179.85,0.96,0.0053,1691712000.0,0.156,0.85,1.308,27.32523,47125074,47125074,58009821,50220610,50220610,0.0,0.0,1400,800,2811029094400,124.17,198.23,7.321666,178.3752,167.8088,0.93,0.005213297,USD,2857832808448.0,0.24681,15616878002.0,15634199552.0,94725628.0,102091714.0,1693440000.0,1695945600.0,0.0061000003,0.00071999995,0.61317,1.44,0.0061000003,15634199552.0,3.852,46.67705,1663977600.0,1695513600.0,1688169600.0,94760001536.0,5.95,6.58,4:1,1598832000.0,7.444,23.055,0.25743055,0.19265866,0.24,1691712000.0,NMS,EQUITY,AAPL,Apple Inc.,Apple Inc.,345479400,America/New_York,EDT,8b10e4ae-9eeb-3684-921a-9ab27e4d87aa,finmb_24937,-14400000,179.8,buy,62482001920.0,3.996,123957002240.0,109280002048.0,0.814,0.982,383932989440.0,181.305,24.22,0.20896,1.60093,170782000000.0,90680500224.0,113071996928.0,-0.014,0.43449003,0.32286,0.28116,USD,2.3005,30.218489,0.023,3.97,240.0,149.0,199.56,200.0,2.0,36.0,0.05,,
BA,929 Long Bridge Drive,Arlington,VA,22202,United States,703 465 3500,https://www.boeing.com,Aerospace & Defense,aerospace-defense,Aerospace & Defense,Industrials,industrials,Industrials,"The Boeing Company, together with its subsidiaries, designs, develops, manufactures, sells, services, and supports commercial jetliners, military aircraft, satellites, missile defense, human space flight and launch systems, and services worldwide. The company operates through four segments: Commercial Airplanes; Defense, Space & Security; Global Services; and Boeing Capital. The Commercial Airplanes segment develops, produces, and markets commercial jet aircraft for passenger and cargo requirements, as well as provides fleet support services. The Defense, Space & Security segment engages in the research, development, production, and modification of manned and unmanned military aircraft and weapons systems; strategic defense and intelligence systems, which include strategic missile and defense systems, command, control, communications, computers, intelligence, surveillance and reconnaissance, cyber and information solutions, and intelligence systems; and satellite systems, such as government and commercial satellites, and space exploration. The Global Services segment offers products and services, including supply chain and logistics management, engineering, maintenance and modifications, upgrades and conversions, spare parts, pilot and maintenance training systems and services, technical and maintenance documents, and data analytics and digital services to commercial and defense customers. The Boeing Capital segment offers financing services and manages financing exposure for a portfolio of equipment under operating leases, sales-type/finance leases, notes and other receivables, assets held for sale or re-lease, and investments. The company was incorporated in 1916 and is based in Arlington, Virginia.",156000.0,"[{'maxAge': 1, 'name': 'Mr. David L. Calhoun', 'age': 64, 'title': 'President, CEO & Director', 'yearBorn': 1958, 'fiscalYear': 2022, 'totalPay': 5480396, 'exercisedValue': 0, 'unexercisedValue': 0}, {'maxAge': 1, 'name': 'Mr. Brian J. West', 'age': 52, 'title': 'Executive VP of Finance & CFO', 'yearBorn': 1970, 'fiscalYear': 2022, 'totalPay': 2636041, 'exercisedValue': 0, 'unexercisedValue': 0}, {'maxAge': 1, 'name': 'Mr. Brett C. Gerry', 'age': 50, 'title': 'Chief Legal Officer & Executive VP of Global Compliance', 'yearBorn': 1972, 'fiscalYear': 2022, 'totalPay': 2176548, 'exercisedValue': 0, 'unexercisedValue': 0}, {'maxAge': 1, 'name': 'Mr. Stanley A. Deal', 'age': 58, 'title': 'Executive VP and President & CEO of Boeing Commercial Airplanes', 'yearBorn': 1964, 'fiscalYear': 2022, 'totalPay': 3155704, 'exercisedValue': 0, 'unexercisedValue': 0}, {'maxAge': 1, 'name': 'Mr. Theodore  Colbert III', 'age': 48, 'title': 'Executive VP, President and CEO of Boeing Defense, Space & Security', 'yearBorn': 1974, 'fiscalYear': 2022, 'totalPay': 2201745, 'exercisedValue': 0, 'unexercisedValue': 0}, {'maxAge': 1, 'name': 'Mr. Andrew  Ward', 'age': 51, 'title': 'Chief Investment Officer', 'yearBorn': 1971, 'fiscalYear': 2022, 'exercisedValue': 0, 'unexercisedValue': 0}, {'maxAge': 1, 'name': 'Dr. Todd  Citron Ph.D.', 'title': 'Chief Technology Officer, VP and GM of Boeing Research & Technology', 'fiscalYear': 2022, 'exercisedValue': 0, 'unexercisedValue': 0}, {'maxAge': 1, 'name': 'Ms. Susan  Doniz BSc, ICD.D', 'age': 52, 'title': 'Chief Information & Data Analytics Officer', 'yearBorn': 1970, 'fiscalYear': 2022, 'exercisedValue': 0, 'unexercisedValue': 0}, {'maxAge': 1, 'name': 'Matt  Welch', 'title': 'Vice President of Investor Relations', 'fiscalYear': 2022, 'exercisedValue': 0, 'unexercisedValue': 0}, {'maxAge': 1, 'name': 'Mr. Darrin A. Hostetler', 'title': 'Chief Compliance Officer & VP of Global Compliance', 'fiscalYear': 2022, 'exercisedValue': 0, 'unexercisedValue': 0}]",5.0,1.0,10.0,5.0,8.0,1696118400.0,1672444800.0,86400,2,193.53,195.47,194.27,199.6199,193.53,195.47,194.27,199.6199,8.22,0.0865,1581552000.0,0.0,2.48,1.482,44.970184,7376995,7376995,5212928,6283240,6283240,0.0,0.0,1200,1100,118270205952,124.17,243.1,1.6067574,214.0288,210.0294,0.0,0.0,USD,156800122880.0,-0.060749996,558295049.0,603203968.0,7392010.0,7404551.0,1693440000.0,1695945600.0,0.0123000005,0.00088,0.61121,1.68,0.0123000005,603203968.0,-25.738,,1672444800.0,1703980800.0,1688083200.0,-4472000000.0,-7.51,4.36,2:1,865814400.0,2.13,145.861,0.48089123,0.19265866,2.055,1581552000.0,NYQ,EQUITY,BA,Boeing Company (The),The Boeing Company,-252322200,America/New_York,EDT,5fc810cf-6260-3df8-8b79-23b9964c53e6,finmb_370857,-14400000,196.07,buy,13761999872.0,22.815,1075000064.0,52267999232.0,0.284,1.167,73608003584.0,,122.527,-0.00385,,5768000000.0,9339625472.0,9203999744.0,0.184,0.0911,0.0146,0.02299,USD,,,,-0.47,310.0,180.0,247.25,250.0,2.0,26.0,,,
CAT,,,,,,,,,,,,,,,,,,,,,,,,86400,2,273.21,273.53,269.9,274.4079,273.21,273.53,269.9,274.4079,,,,,,,12.991904,1537014,1537014,2480542,2130850,2130850,0.0,0.0,1200,1200,140874661888,172.71,293.88,,276.8202,246.27596,3.6,0.013176678,USD,,,,,,,,,,,,,,,,,,,,,,,,,,,,,,,NYQ,EQUITY,CAT,"Caterpillar, Inc.",Caterpillar Inc.,-252322200,America/New_York,EDT,c01ae1a5-f122-325c-a567-5f86028b536a,finmb_259378,-14400000,272.83,hold,,,,,,,,,,,,15565000000.0,,,,,,,USD,1.4004,20.179731,,,350.0,175.0,284.5,290.0,2.6,20.0,,,
CVX,6001 Bollinger Canyon Road,San Ramon,CA,94583-2324,United States,925 842 1000,https://www.chevron.com,Oil & Gas Integrated,oil-gas-integrated,Oil & Gas Integrated,Energy,energy,Energy,"Chevron Corporation, through its subsidiaries, engages in the integrated energy and chemicals operations in the United States and internationally. The company operates in two segments, Upstream and Downstream. The Upstream segment is involved in the exploration, development, production, and transportation of crude oil and natural gas; liquefaction, transportation, and regasification associated with liquefied natural gas; transportation of crude oil through pipelines; and processing, transportation, storage, and marketing of natural gas, as well as a gas-to-liquids plant. The Downstream segment refines crude oil into petroleum products; markets crude oil, refined products, and lubricants; manufactures and markets renewable fuels; transports crude oil and refined products by pipeline, marine vessel, motor equipment, and rail car; and manufactures and markets commodity petrochemicals, plastics for industrial uses, and fuel and lubricant additives. The company was formerly known as ChevronTexaco Corporation and changed its name to Chevron Corporation in 2005. Chevron Corporation was founded in 1879 and is headquartered in San Ramon, California.",43846.0,"[{'maxAge': 1, 'name': 'Mr. Michael K. Wirth', 'age': 61, 'title': 'Chairman & CEO', 'yearBorn': 1961, 'fiscalYear': 2022, 'totalPay': 6663900, 'exercisedValue': 8106811, 'unexercisedValue': 89575352}, {'maxAge': 1, 'name': 'Mr. Pierre R. Breber', 'age': 58, 'title': 'VP & CFO', 'yearBorn': 1964, 'fiscalYear': 2022, 'totalPay': 3014142, 'exercisedValue': 6555365, 'unexercisedValue': 42286152}, {'maxAge': 1, 'name': 'Mr. R. Hewitt Pate', 'age': 59, 'title': 'VP & General Counsel', 'yearBorn': 1963, 'fiscalYear': 2022, 'totalPay': 3308968, 'exercisedValue': 19423408, 'unexercisedValue': 10195197}, {'maxAge': 1, 'name': 'Ms. Eimear P. Bonner', 'age': 47, 'title': 'VP, CTO & President of Chevron Technical Center', 'yearBorn': 1975, 'fiscalYear': 2022, 'exercisedValue': 0, 'unexercisedValue': 0}, {'maxAge': 1, 'name': 'Ms. Rhonda J. Morris', 'age': 57, 'title': 'VP & Chief Human Resources Officer', 'yearBorn': 1965, 'fiscalYear': 2022, 'exercisedValue': 0, 'unexercisedValue': 0}, {'maxAge': 1, 'name': 'Mr. A. Nigel Hearne', 'age': 54, 'title': 'Executive Vice President of Oil, Products & Gas', 'yearBorn': 1968, 'fiscalYear': 2022, 'exercisedValue': 0, 'unexercisedValue': 0}, {'maxAge': 1, 'name': 'Mr. Clay  Neff', 'age': 60, 'title': 'President of International Exploration & Production', 'yearBorn': 1962, 'fiscalYear': 2022, 'exercisedValue': 0, 'unexercisedValue': 0}, {'maxAge': 1, 'name': 'Mr. Jeff B. Gustavson', 'age': 50, 'title': 'President of Chevron New Energies & VP of Lower Carbon Energies', 'yearBorn': 1972, 'fiscalYear': 2022, 'exercisedValue': 0, 'unexercisedValue': 0}, {'maxAge': 1, 'name': 'Dr. Anoop  Kumar', 'title': 'President of the National Lubricating Grease', 'fiscalYear': 2022, 'exercisedValue': 0, 'unexercisedValue': 0}, {'maxAge': 1, 'name': 'Mr. Balaji  Krishnamurthy', 'age': 45, 'title': 'Vice President of Strategy & Sustainability', 'yearBorn': 1977, 'fiscalYear': 2022, 'exercisedValue': 0, 'unexercisedValue': 0}]",3.0,4.0,3.0,1.0,1.0,1696118400.0,1672444800.0,86400,2,166.54,165.07,160.48,165.08,166.54,165.07,160.48,165.08,6.04,0.0375,1692230400.0,0.3716,4.4,1.137,10.959185,12530835,12530835,7526781,8272920,8272920,0.0,0.0,1100,1000,307314360320,149.74,189.68,1.4315531,163.6176,163.59555,5.86,0.035186745,USD,313690193920.0,0.14053,1742998721.0,1907600000.0,15846290.0,15438925.0,1693440000.0,1695945600.0,0.0083,0.00035999998,0.72579,2.13,0.0083,1907600000.0,84.791,1.8999659,1672444800.0,1703980800.0,1688083200.0,30168000512.0,15.77,14.7,2:1,1095033600.0,1.461,6.079,-0.02529043,0.19265866,1.51,1692230400.0,NYQ,EQUITY,CVX,Chevron Corporation,Chevron Corporation,-252322200,America/New_York,EDT,030410ed-236a-3375-b5de-4212d6028be6,finmb_98506,-14400000,161.1,buy,9610000384.0,5.147,51600998400.0,21514000384.0,0.966,1.434,214671998976.0,13.506,112.996,0.08943,0.19263001,98886000000.0,23395500032.0,41266999296.0,-0.281,0.40131,0.24037,0.14092,USD,,10.215599,-0.483,-1.57,215.0,165.0,188.32,187.0,2.2,25.0,-0.462,,
