HD,2455 Paces Ferry Road,Atlanta,GA,30339,United States,770 433 8211,https://www.homedepot.com,Home Improvement Retail,home-improvement-retail,Home Improvement Retail,Consumer Cyclical,consumer-cyclical,Consumer Cyclical,"The Home Depot, Inc. operates as a home improvement retailer. It sells various building materials, home improvement products, lawn and garden products, and décor products, as well as facilities maintenance, repair, and operations products. The company also offers installation services for flooring, water heaters, bath, garage doors, cabinets, cabinet makeovers, countertops, sheds, furnaces and central air systems, and windows. In addition, it provides tool and equipment rental services. The company primarily serves homeowners; and professional renovators/remodelers, general contractors, maintenance professionals, handymen, property managers, and building service contractors, as well as specialty tradesmen, such as electricians, plumbers, and painters. It also sells its products through websites, including homedepot.com; homedepot.ca and homedepot.com.mx; blinds.com, an online site for custom window coverings; and thecompanystore.com, an online site for textiles and décor products, as well as through The Home Depot stores. The Home Depot, Inc. was incorporated in 1978 and is based in Atlanta, Georgia.",470000.0,"[{'maxAge': 1, 'name': 'Mr. Edward P. Decker', 'age': 59, 'title': 'Chairman, President & CEO', 'yearBorn': 1963, 'fiscalYear': 2022, 'totalPay': 4316043, 'exercisedValue': 10184488, 'unexercisedValue': 19560360}, {'maxAge': 1, 'name': 'Mr. Richard V. McPhail', 'age': 51, 'title': 'Executive VP & CFO', 'yearBorn': 1971, 'fiscalYear': 2022, 'totalPay': 1834528, 'exercisedValue': 0, 'unexercisedValue': 6538627}, {'maxAge': 1, 'name': 'Mr. Matthew A. Carey', 'age': 57, 'title': 'Executive Vice President of Customer Experience', 'yearBorn': 1965, 'fiscalYear': 2022, 'totalPay': 1809547, 'exercisedValue': 0, 'unexercisedValue': 6308432}, {'maxAge': 1, 'name': 'Ms. Ann-Marie  Campbell', 'age': 56, 'title': 'Executive Vice President of U.S. Stores & International Operations', 'yearBorn': 1966, 'fiscalYear': 2022, 'totalPay': 1872465, 'exercisedValue': 1796322, 'unexercisedValue': 7742751}, {'maxAge': 1, 'name': 'Ms. Angie  Brown', 'title': 'Senior Vice President of Technology', 'fiscalYear': 2022, 'totalPay': 85000, 'exercisedValue': 0, 'unexercisedValue': 0}, {'maxAge': 1, 'name': 'Mr. Haydn  Chilcott', 'title': 'Senior Vice President of Operations', 'fiscalYear': 2022, 'exercisedValue': 0, 'unexercisedValue': 0}, {'maxAge': 1, 'name': 'Ms. Kimberly R. Scardino', 'age': 51, 'title': 'SVP of Finance, Chief Accounting Officer & Controller', 'yearBorn': 1971, 'fiscalYear': 2022, 'exercisedValue': 0, 'unexercisedValue': 0}, {'maxAge': 1, 'name': 'Mr. Fahim  Siddiqui', 'age': 56, 'title': 'Executive VP & Chief Information Officer', 'yearBorn': 1966, 'fiscalYear': 2022, 'exercisedValue': 0, 'unexercisedValue': 0}, {'maxAge': 1, 'name': 'Ms. Isabel  Janci', 'title': 'VP of Investor Relations & Treasurer', 'fiscalYear': 2022, 'exercisedValue': 0, 'unexercisedValue': 0}, {'maxAge': 1, 'name': 'Ms. Teresa Wynn Roseborough', 'age': 63, 'title': 'Executive VP, General Counsel & Corporate Secretary', 'yearBorn': 1959, 'fiscalYear': 2022, 'exercisedValue': 0, 'unexercisedValue': 0}]",5.0,6.0,5.0,1.0,2.0,1696118400.0,1672444800.0,86400,2,299.22,299.74,295.9,300.85,299.22,299.74,295.9,300.85,8.36,0.027999999,1693353600.0,0.4981,2.27,0.928,18.409512,2290553,2290553,2856851,2797310,2797310,0.0,0.0,1000,800,298070867968,267.87,347.25,1.9245775,318.5026,307.6802,8.17,0.027304325,USD,344748654592.0,0.10481,998825900.0,1000070016.0,9014161.0,9426437.0,1693440000.0,1695945600.0,0.009,0.00087,0.72856003,3.26,0.009,1000070016.0,1.334,223.42578,1674950400.0,1706486400.0,1690675200.0,16232999936.0,16.01,16.19,3:2,946598400.0,2.226,13.194,0.05381322,0.19265866,2.09,1693353600.0,NYQ,EQUITY,HD,"Home Depot, Inc. (The)","The Home Depot, Inc.",370013400,America/New_York,EDT,27178471-f2c4-319c-872d-1545a0f154c7,finmb_278679,-14400000,298.05,buy,2814000128.0,2.814,26129999872.0,49493000192.0,0.274,1.314,154876002304.0,3707.341,153.115,0.18921,20.652672,52778000000.0,12748624896.0,19637999616.0,-0.02,0.33486998,0.16871999,0.15353,USD,1.7753,18.61649,-0.099,17.87,384.0,248.0,343.35,350.0,2.2,31.0,-0.079,,
IBM,One New Orchard Road,Armonk,NY,10504,United States,914 499 1900,https://www.ibm.com,Information Technology Services,information-technology-services,Information Technology Services,Technology,technology,Technology,"International Business Machines Corporation, together with its subsidiaries, provides integrated solutions and services worldwide. The company operates through four business segments: Software, Consulting, Infrastructure, and Financing. The Software segment offers hybrid cloud platform and software solutions; software for business automation, AIOps and management, integration, and application servers; data and artificial intelligence solutions; and security software and services for threat, data, and identity. This segment also provides transaction processing software that supports clients' mission-critical and on-premise workloads in banking, airlines, and retail industries. The Consulting segment offers business transformation services, including strategy, business process design and operations, data and analytics, and system integration services; technology consulting services; and application and cloud platform services. The Infrastructure segment provides on-premises and cloud-based server and storage solutions for its clients' mission-critical and regulated workloads; and support services and solutions for hybrid cloud infrastructure, as well as remanufacturing and remarketing services for used equipment. The Financing segment offers lease, installment payment, loan financing, and short-term working capital financing services. The company has collaboration agreement with Siemens Digital Industri Software to develop a combined software solution. The company was formerly known as Computing-Tabulating-Recording Co. International Business Machines Corporation was incorporated in 1911 and is headquartered in Armonk, New York.",288300.0,"[{'maxAge': 1, 'name': 'Mr. Arvind  Krishna', 'age': 59, 'title': 'CEO & Chairman of the Board', 'yearBorn': 1963, 'fiscalYear': 2022, 'totalPay': 5618738, 'exercisedValue': 0, 'unexercisedValue': 0}, {'maxAge': 1, 'name': 'Mr. James J. Kavanaugh', 'age': 55, 'title': 'Senior VP & CFO', 'yearBorn': 1967, 'fiscalYear': 2022, 'totalPay': 2939023, 'exercisedValue': 0, 'unexercisedValue': 0}, {'maxAge': 1, 'name': 'Ms. Michelle H. Browdy', 'age': 57, 'title': 'Senior VP of Legal & Regulatory Affairs and General Counsel', 'yearBorn': 1965, 'fiscalYear': 2022, 'totalPay': 2539493, 'exercisedValue': 0, 'unexercisedValue': 0}, {'maxAge': 1, 'name': 'Mr. Gary D. Cohn', 'age': 61, 'title': 'Executive Vice Chairman', 'yearBorn': 1961, 'fiscalYear': 2022, 'totalPay': 3172218, 'exercisedValue': 0, 'unexercisedValue': 0}, {'maxAge': 1, 'name': 'Ms. Joanne  Wright', 'title': 'Senior Vice President of Transformation & Operations', 'fiscalYear': 2022, 'exercisedValue': 0, 'unexercisedValue': 0}, {'maxAge': 1, 'name': 'Mr. Alexander Franz Stern', 'age': 56, 'title': 'Senior VP of Strategy, M&A, Corporate Development and Investor Relations', 'yearBorn': 1966, 'fiscalYear': 2022, 'exercisedValue': 0, 'unexercisedValue': 0}, {'maxAge': 1, 'name': 'Mr. Jonathan H. Adashek', 'title': 'Senior VP of Marketing & Communications and Chief Communications Officer', 'fiscalYear': 2022, 'exercisedValue': 0, 'unexercisedValue': 0}, {'maxAge': 1, 'name': 'Ms. Nickle Jaclyn LaMoreaux', 'age': 42, 'title': 'Senior VP & Chief Human Resources Officer', 'yearBorn': 1980, 'fiscalYear': 2022, 'exercisedValue': 0, 'unexercisedValue': 0}, {'maxAge': 1, 'name': 'Dr. Bernard S. Meyerson Ph.D.', 'title': 'Chief Innovation Officer Emeritus', 'fiscalYear': 2022, 'exercisedValue': 0, 'unexercisedValue': 0}, {'maxAge': 1, 'name': 'Mr. Kirill  Korniliev', 'title': 'VP of Sales and Head of The Industry Solutions Area In Central & Eastern Europe', 'fiscalYear': 2022, 'exercisedValue': 0, 'unexercisedValue': 0}]",5.0,6.0,5.0,4.0,5.0,1696118400.0,1672444800.0,86400,2,142.11,142.51,142.14,143.34,142.11,142.51,142.14,143.34,6.64,0.0464,1691539200.0,2.8128,4.95,0.771,14.223436,2510183,2510183,4011015,3530010,3530010,0.0,0.0,800,1000,130483388416,115.55,153.21,2.1558595,144.4058,135.4957,6.61,0.046513267,USD,174559428608.0,0.03346,909821932.0,911006016.0,28775392.0,27543140.0,1693440000.0,1695945600.0,0.031600002,0.00091,0.57935,7.22,0.031600002,911006016.0,24.37,5.877308,1672444800.0,1703980800.0,1688083200.0,2169999872.0,2.35,10.07,1046:1000,1635984000.0,2.884,13.443,0.17604077,0.19265866,1.66,1691539200.0,NYQ,EQUITY,IBM,International Business Machines,International Business Machines Corporation,-252322200,America/New_York,EDT,cbf44511-d041-3c6d-9dd7-3cc0c033122c,finmb_112350,-14400000,143.23,buy,16298000384.0,17.89,12984999936.0,60303998976.0,0.885,1.06,60524998656.0,270.774,66.745,0.04107,0.10396,32688000000.0,10071374848.0,12277999616.0,-0.004,0.54642,0.21454,0.14753,USD,2.1841,60.948936,0.137,4.37,188.0,110.0,146.0,145.0,2.5,15.0,0.126,,
INTC,2200 Mission College Boulevard,Santa Clara,CA,95054-1549,United States,408 765 8080,https://www.intel.com,Semiconductors,semiconductors,Semiconductors,Technology,technology,Technology,"Intel Corporation designs, develops, manufactures, markets, and sells computing and related products worldwide. It operates through Client Computing Group, Data Center and AI, Network and Edge, Mobileye, Accelerated Computing Systems and Graphics, Intel Foundry Services, and Other segments. The company offers platform products, such as central processing units and chipsets, and system-on-chip and multichip packages; and accelerators, boards and systems, connectivity products, and memory and storage products. It also provides high-performance computer solutions for targeted verticals and embedded applications for retail, industrial, and healthcare markets; and solutions for assisted and autonomous driving comprising compute platforms, computer vision and machine learning-based sensing, mapping and localization, driving policy, and active sensors. In addition, the company offers workload-optimized platforms and related products for cloud service providers, enterprise and government, and communications service providers. It serves original equipment manufacturers, original design manufacturers, cloud service providers, and other equipment manufacturers. The company has a strategic partnership with Synopsys, Inc. to develop EDA and IP solutions and a collaboration with Red Hat to. deliver open source industrial automation to the manufacturing shop floor. The company The company was incorporated in 1968 and is headquartered in Santa Clara, California.",131900.0,"[{'maxAge': 1, 'name': 'Mr. Patrick P. Gelsinger', 'age': 61, 'title': 'CEO & Director', 'yearBorn': 1961, 'fiscalYear': 2022, 'totalPay': 2745100, 'exercisedValue': 0, 'unexercisedValue': 0}, {'maxAge': 1, 'name': 'Mr. David A. Zinsner', 'age': 53, 'title': 'Executive VP & CFO', 'yearBorn': 1969, 'fiscalYear': 2022, 'totalPay': 3801577, 'exercisedValue': 0, 'unexercisedValue': 0}, {'maxAge': 1, 'name': 'Mr. Christoph  Schell', 'age': 50, 'title': 'Executive VP, Chief Commercial Officer and GM of Sales, Marketing & Communications Group', 'yearBorn': 1972, 'fiscalYear': 2022, 'totalPay': 21367628, 'exercisedValue': 0, 'unexercisedValue': 0}, {'maxAge': 1, 'name': 'Ms. Sandra L. Rivera', 'age': 57, 'title': 'Executive VP and GM of Datacenter & AI', 'yearBorn': 1965, 'fiscalYear': 2022, 'totalPay': 1662700, 'exercisedValue': 0, 'unexercisedValue': 0}, {'maxAge': 1, 'name': 'Ms. Michelle C. Johnston Holthaus', 'age': 48, 'title': 'Executive VP & GM of Client Computing Group', 'yearBorn': 1974, 'fiscalYear': 2022, 'totalPay': 1636500, 'exercisedValue': 0, 'unexercisedValue': 0}, {'maxAge': 1, 'name': 'Mr. George S. Davis', 'age': 64, 'title': 'Executive Adviser', 'yearBorn': 1958, 'fiscalYear': 2022, 'totalPay': 1199678, 'exercisedValue': 0, 'unexercisedValue': 0}, {'maxAge': 1, 'name': 'Mr. Keyvan  Esfarjani', 'title': 'Executive VP, Chief Global Operations Officer and GM of Manufacturing, Supply Chain & Operations', 'fiscalYear': 2022, 'exercisedValue': 0, 'unexercisedValue': 0}, {'maxAge': 1, 'name': 'Mr. Scott C. Gawel', 'age': 51, 'title': 'Corporate VP & Chief Accounting Officer', 'yearBorn': 1971, 'fiscalYear': 2022, 'exercisedValue': 0, 'unexercisedValue': 0}, {'maxAge': 1, 'name': 'Mr. Greg  Lavender', 'title': 'CTO, Senior VP, and GM of Software & Advanced Technology Group', 'fiscalYear': 2022, 'exercisedValue': 0, 'unexercisedValue': 0}, {'maxAge': 1, 'name': 'Mr. John William Pitzer', 'title': 'Corporate Vice President of Corporate Planning & Investor Relations', 'fiscalYear': 2022, 'exercisedValue': 0, 'unexercisedValue': 0}]",3.0,2.0,9.0,2.0,2.0,1696118400.0,1672444800.0,86400,2,36.43,36.62,36.38,37.02,36.43,36.62,36.38,37.02,0.5,0.0136,1691107200.0,0.7526,3.0,0.893,21.074286,18767355,18767355,36818071,29394090,29394090,0.0,0.0,900,2900,154453442560,24.59,40.07,2.8579202,35.406,31.5811,1.22,0.033488885,USD,182696443904.0,-0.01706,4184147040.0,4188000000.0,56325495.0,61560688.0,1693440000.0,1695945600.0,0.0134000005,0.00061,0.64658,1.37,0.0135,4188000000.0,24.121,1.5289582,1672444800.0,1703980800.0,1688169600.0,-922000000.0,-0.23,1.75,2:1,965001600.0,3.381,20.808,0.39591217,0.19265866,0.125,1691107200.0,NMS,EQUITY,INTC,Intel Corporation,Intel Corporation,322151400,America/New_York,EDT,fc39dab3-4bbe-3356-80d3-0933db783ba0,finmb_21127,-14400000,36.88,hold,24256999424.0,5.792,8780000256.0,49045999616.0,1.01,1.595,54044000256.0,46.947,13.04,-0.00843,-0.00911,26866000000.0,-9475375104.0,9756000256.0,-0.155,0.38267,0.16246,-0.06302,USD,1.7987,,,7.51,56.0,17.0,35.59,35.5,3.0,36.0,,,
JNJ,One Johnson & Johnson Plaza,New Brunswick,NJ,08933,United States,732 524 0400,https://www.jnj.com,Drug Manufacturers - General,drug-manufacturers-general,Drug Manufacturers - General,Healthcare,healthcare,Healthcare,"Johnson & Johnson, together with its subsidiaries, researches, develops, manufactures, and sells various products in the healthcare field worldwide. The company's Consumer Health segment provides skin health/beauty products under the AVEENO, CLEAN & CLEAR, DR. CI:LABO, NEUTROGENA, and OGX brands; baby care products under the JOHNSON'S and AVEENO Baby brands; oral care products under the LISTERINE brand; TYLENOL acetaminophen products; SUDAFED cold, flu, and allergy products; BENADRYL and ZYRTEC allergy products; MOTRIN IB ibuprofen products; NICORETTE smoking cessation products; and PEPCID acid reflux products. This segment also offers STAYFREE and CAREFREE sanitary pads; o.b. tampons; adhesive bandages under the BAND-AID brand; and first aid products under the NEOSPORIN brand. It serves general public, retail outlets, and distributors. The company's Pharmaceutical segment provides products for rheumatoid arthritis, psoriatic arthritis, inflammatory bowel disease, and psoriasis; HIV/AIDS infectious diseases; mood disorders, neurodegenerative disorders, and schizophrenia; prostate cancer, hematologic malignancies, lung cancer, and bladder cancer; thrombosis, diabetes, and macular degeneration; and pulmonary arterial hypertension. This segment serves retailers, wholesalers, distributors, hospitals, and healthcare professionals directly for prescription use. Its MedTech segment offers electrophysiology products to treat cardiovascular diseases; neurovascular care products to treat hemorrhagic and ischemic stroke; orthopaedics products in support of hips, knees, trauma, spine, sports, and other; advanced and general surgery solutions that focus on breast aesthetics, ear, nose, and throat procedures; and contact lenses and ophthalmic technologies related to cataract and laser refractive surgery under the ACUVUE brand. This segment serves wholesalers, hospitals, and retailers. Johnson & Johnson was founded in 1886 and is based in New Brunswick, New Jersey.",152700.0,"[{'maxAge': 1, 'name': 'Mr. Joaquin  Duato', 'age': 59, 'title': 'CEO & Chairman', 'yearBorn': 1963, 'fiscalYear': 2022, 'totalPay': 4839699, 'exercisedValue': 8650825, 'unexercisedValue': 63282216}, {'maxAge': 1, 'name': 'Mr. Joseph J. Wolk CPA', 'age': 55, 'title': 'Executive VP & CFO', 'yearBorn': 1967, 'fiscalYear': 2022, 'totalPay': 2262233, 'exercisedValue': 1351073, 'unexercisedValue': 6964844}, {'maxAge': 1, 'name': 'Ms. Ashley A. McEvoy', 'age': 51, 'title': 'Executive VP & Worldwide Chairman of MedTech', 'yearBorn': 1971, 'fiscalYear': 2022, 'totalPay': 1919173, 'exercisedValue': 7546953, 'unexercisedValue': 17984952}, {'maxAge': 1, 'name': 'Ms. Jennifer L. Taubert', 'age': 58, 'title': 'Executive VP & Worldwide Chairman of Pharmaceuticals', 'yearBorn': 1964, 'fiscalYear': 2022, 'totalPay': 2156653, 'exercisedValue': 8018407, 'unexercisedValue': 21548668}, {'maxAge': 1, 'name': 'Mr. Robert J. Decker Jr.', 'age': 50, 'title': 'Controller & Chief Accounting Officer', 'yearBorn': 1972, 'fiscalYear': 2022, 'exercisedValue': 0, 'unexercisedValue': 0}, {'maxAge': 1, 'name': 'Mr. James  Swanson', 'age': 56, 'title': 'Executive VP & Chief Information Officer', 'yearBorn': 1966, 'fiscalYear': 2022, 'exercisedValue': 0, 'unexercisedValue': 0}, {'maxAge': 1, 'name': 'Ms. Jessica  Moore', 'title': 'Vice President of Investor Relations', 'fiscalYear': 2022, 'exercisedValue': 0, 'unexercisedValue': 0}, {'maxAge': 1, 'name': 'Mr. Dirk  Brinckman', 'title': 'Chief Compliance Officer', 'fiscalYear': 2022, 'exercisedValue': 0, 'unexercisedValue': 0}, {'maxAge': 1, 'name': 'Ms. Elizabeth  Forminard', 'age': 51, 'title': 'Executive VP & General Counsel', 'yearBorn': 1971, 'fiscalYear': 2022, 'exercisedValue': 0, 'unexercisedValue': 0}, {'maxAge': 1, 'name': 'Dr. Peter M. Fasolo Ph.D.', 'age': 59, 'title': 'Executive VP & Chief Human Resources Officer', 'yearBorn': 1963, 'fiscalYear': 2022, 'totalPay': 1283141, 'exercisedValue': 0, 'unexercisedValue': 0}]",10.0,5.0,3.0,2.0,5.0,1696118400.0,1672444800.0,86400,2,158.36,158.38,156.04,159.05,158.36,158.38,156.04,159.05,4.76,0.0305,1692921600.0,0.929,2.63,0.572,14.315307,6921727,6921727,22436981,6190210,6190210,0.0,0.0,1000,800,376082989056,150.11,181.04,3.846491,163.8258,162.7661,4.58,0.028921444,USD,424264073216.0,0.13351,2595175098.0,2408009984.0,17728409.0,32863484.0,1693440000.0,1695945600.0,0.0074,0.00097000005,0.70794,2.21,0.0074,2408009984.0,28.924,5.3996677,1672531200.0,1704067200.0,1688256000.0,13054000128.0,4.94,10.91,2:1,992390400.0,4.339,12.365,-0.054314256,0.19265866,1.19,1692921600.0,NYQ,EQUITY,JNJ,Johnson & Johnson,Johnson & Johnson,-252322200,America/New_York,EDT,73aa25b0-87c8-3616-a460-03cbef1b4753,finmb_139677,-14400000,156.18,buy,28504999936.0,10.968,34313000960.0,45602000896.0,0.836,1.118,97773002752.0,59.681,37.44,0.0915,0.1709,63954000000.0,21505124352.0,19072999424.0,0.063,0.67497003,0.35095,0.28915,USD,5.163,31.615383,0.069,2.75,215.0,158.0,180.71,180.0,2.4,21.0,0.089,,
JPM,383 Madison Avenue,New York,NY,10179,United States,212 270 6000,https://www.jpmorganchase.com,Banks - Diversified,banks-diversified,Banks - Diversified,Financial Services,financial-services,Financial Services,"JPMorgan Chase & Co. operates as a financial services company worldwide. It operates through four segments: Consumer & Community Banking (CCB), Corporate & Investment Bank (CIB), Commercial Banking (CB), and Asset & Wealth Management (AWM). The CCB segment offers deposit, investment and lending products, cash management, and payments and services to consumers and small businesses; mortgage origination and servicing activities; residential mortgages and home equity loans; and credit cards, auto loans, leases, and travel services. The CIB segment provides investment banking products and services, including corporate strategy and structure advisory, and equity and debt markets capital-raising services, as well as loan origination and syndication; payments and cross-border financing; and cash and derivative instruments, risk management solutions, prime brokerage, and research. This segment also offers securities services, including custody, fund accounting and administration, and securities lending products for asset managers, insurance companies, and public and private investment funds. The CB segment provides financial solutions, including lending, payments, investment banking, and asset management to small and midsized companies, local governments, nonprofit clients, and large corporations; and commercial real estate banking services to investors, developers, and owners of multifamily, office, retail, industrial, and affordable housing properties. The AWM segment offers multi-asset investment management solutions in equities, fixed income, alternatives, and money market funds to institutional clients and retail investors; and retirement products and services, brokerage, custody, estate planning, lending, deposits, and investment management products. The company also provides ATM, online and mobile, and telephone banking services. JPMorgan Chase & Co. was founded in 1799 and is headquartered in New York, New York.",300066.0,"[{'maxAge': 1, 'name': 'Mr. James  Dimon', 'age': 66, 'title': 'Chairman & CEO', 'yearBorn': 1956, 'fiscalYear': 2022, 'totalPay': 6818729, 'exercisedValue': 0, 'unexercisedValue': 0}, {'maxAge': 1, 'name': 'Mr. Daniel Eduardo Pinto', 'age': 59, 'title': 'President & COO', 'yearBorn': 1963, 'fiscalYear': 2022, 'totalPay': 7162401, 'exercisedValue': 7226498, 'unexercisedValue': 0}, {'maxAge': 1, 'name': 'Mr. Jeremy  Barnum', 'age': 49, 'title': 'Executive VP & CFO', 'yearBorn': 1973, 'fiscalYear': 2022, 'totalPay': 5255000, 'exercisedValue': 0, 'unexercisedValue': 0}, {'maxAge': 1, 'name': 'Ms. Mary Callahan Erdoes', 'age': 55, 'title': 'Chief Executive Officer of Asset & Wealth Management', 'yearBorn': 1967, 'fiscalYear': 2022, 'totalPay': 10655000, 'exercisedValue': 0, 'unexercisedValue': 0}, {'maxAge': 1, 'name': 'Ms. Marianne  Lake', 'age': 52, 'title': 'Co-Chief Executive Officer of Consumer & Community Banking', 'yearBorn': 1970, 'fiscalYear': 2022, 'totalPay': 7520688, 'exercisedValue': 0, 'unexercisedValue': 0}, {'maxAge': 1, 'name': 'Ms. Jennifer A. Piepszak', 'age': 51, 'title': 'Co-Chief Executive Officer of Consumer & Community Banking', 'yearBorn': 1971, 'fiscalYear': 2022, 'totalPay': 7455000, 'exercisedValue': 0, 'unexercisedValue': 0}, {'maxAge': 1, 'name': 'Ms. Elena A. Korablina', 'age': 48, 'title': 'MD, Firmwide Controller & Principal Accounting Officer', 'yearBorn': 1974, 'fiscalYear': 2022, 'exercisedValue': 0, 'unexercisedValue': 0}, {'maxAge': 1, 'name': 'Ms. Lori Ann Beer', 'age': 54, 'title': 'Global Chief Information Officer', 'yearBorn': 1968, 'fiscalYear': 2022, 'exercisedValue': 0, 'unexercisedValue': 0}, {'maxAge': 1, 'name': 'Mr. Mikael  Grubb', 'title': 'Head of Investor Relations', 'fiscalYear': 2022, 'exercisedValue': 0, 'unexercisedValue': 0}, {'maxAge': 1, 'name': 'Ms. Stacey  Friedman', 'age': 53, 'title': 'Executive VP & General Counsel', 'yearBorn': 1969, 'fiscalYear': 2022, 'exercisedValue': 0, 'unexercisedValue': 0}]",10.0,6.0,7.0,3.0,6.0,1696118400.0,1672444800.0,86400,2,145.65,145.42,145.02,147.23,145.65,145.42,145.02,147.23,4.2,0.0287,1696464000.0,0.2572,2.85,1.1,9.808724,7337488,7337488,9030178,9330710,9330710,0.0,0.0,900,800,424725020672,101.76,159.38,3.1409926,148.1422,141.4172,4.0,0.027463097,USD,-233698639872.0,0.35379001,2892571976.0,2906089984.0,17414414.0,18565057.0,1693440000.0,1695945600.0,0.006,0.00885,0.71106005,2.05,0.006,2906089984.0,98.109,1.4896696,1672444800.0,1703980800.0,1688083200.0,46057000960.0,15.55,14.9,3:2,960768000.0,-1.728,,0.33628964,0.19265866,1.05,1696464000.0,NYQ,EQUITY,JPM,JP Morgan Chase & Co.,JPMorgan Chase & Co.,322151400,America/New_York,EDT,bc753df4-b894-3e19-9c58-995ef66d8e67,finmb_658776,-14400000,146.15,buy,1432146935808.0,492.81,,746319970304.0,,,135220002816.0,,45.697,0.012410001,0.15982,122306000000.0,,-9358000128.0,0.206,0.0,0.0,0.42863998,USD,2.962,9.398713,0.673,-2.09,215.0,140.0,169.18,167.0,2.1,25.0,0.721,,
