CSCO,170 West Tasman Drive,San Jose,CA,95134-1706,United States,(408) 526-4000,https://www.cisco.com,Communication Equipment,communication-equipment,Communication Equipment,Technology,technology,Technology,"Cisco Systems, Inc. designs, manufactures, and sells Internet Protocol based networking and other products related to the communications and information technology industry in the Americas, Europe, the Middle East, Africa, the Asia Pacific, Japan, and China. The company also offers switching portfolio encompasses campus switching as well as data center switching; enterprise routing portfolio interconnects public and private wireline and mobile networks, delivering highly secure, and reliable connectivity to campus, data center and branch networks; wireless products include wireless access points and controllers; and compute portfolio including the cisco unified computing system, hyperflex, and software management capabilities, which combine computing, networking, and storage infrastructure management and virtualization. In addition, it provides Internet for the future product consists of routed optical networking, 5G, silicon, and optics solutions; collaboration products, such as meetings, collaboration devices, calling, contact center, and communication platform as a service; end-to-end security product consists of network security, cloud security, security endpoints, unified threat management, and zero trust; and optimized application experiences products including full stack observability and network assurance. Further, the company offers a range of service and support options for its customers, including technical support and advanced services and advisory services. It serves businesses of various sizes, public institutions, governments, and service providers. The company sells its products and services directly, as well as through systems integrators, service providers, other resellers, and distributors. Cisco Systems, Inc. has strategic alliances with other companies. Cisco Systems, Inc. was incorporated in 1984 and is headquartered in San Jose, California.",84900.0,"[{'maxAge': 1, 'name': 'Mr. Charles H. Robbins', 'age': 56, 'title': 'Chairman & CEO', 'yearBorn': 1966, 'fiscalYear': 2022, 'totalPay': 4417387, 'exercisedValue': 0, 'unexercisedValue': 0}, {'maxAge': 1, 'name': 'Mr. Richard Scott Herren', 'age': 60, 'title': 'Executive VP & CFO', 'yearBorn': 1962, 'fiscalYear': 2022, 'totalPay': 2151237, 'exercisedValue': 0, 'unexercisedValue': 0}, {'maxAge': 1, 'name': 'Ms. Maria N. Martinez', 'age': 64, 'title': 'Executive VP & COO', 'yearBorn': 1958, 'fiscalYear': 2022, 'totalPay': 1947416, 'exercisedValue': 0, 'unexercisedValue': 0}, {'maxAge': 1, 'name': 'Ms. Deborah L. Stahlkopf', 'age': 52, 'title': 'Executive VP, Chief Legal Officer & Chief Compliance Officer', 'yearBorn': 1970, 'fiscalYear': 2022, 'totalPay': 3771383, 'exercisedValue': 0, 'unexercisedValue': 0}, {'maxAge': 1, 'name': 'Mr. Jeffery S. Sharritts', 'age': 53, 'title': 'Executive VP and Chief Customer & Partner Officer', 'yearBorn': 1969, 'fiscalYear': 2022, 'totalPay': 3186216, 'exercisedValue': 0, 'unexercisedValue': 0}, {'maxAge': 1, 'name': 'Ms. M. Victoria Wong', 'age': 55, 'title': 'Senior VP & Chief Accounting Officer', 'yearBorn': 1967, 'fiscalYear': 2022, 'exercisedValue': 0, 'unexercisedValue': 0}, {'maxAge': 1, 'name': 'Mr. Andrew  Ashton', 'title': 'Senior Vice President of Corporate Finance', 'fiscalYear': 2022, 'exercisedValue': 0, 'unexercisedValue': 0}, {'maxAge': 1, 'name': 'Mr. Fletcher  Previn', 'title': 'Senior VP & Chief Information Officer', 'fiscalYear': 2022, 'exercisedValue': 0, 'unexercisedValue': 0}, {'maxAge': 1, 'name': 'Ms. Marilyn  Mora', 'title': 'Director of Global Investor Relations', 'fiscalYear': 2022, 'exercisedValue': 0, 'unexercisedValue': 0}, {'maxAge': 1, 'name': 'Ms. Maria  Poveromo', 'title': 'Senior VP & Chief Communications Officer', 'fiscalYear': 2022, 'exercisedValue': 0, 'unexercisedValue': 0}]",1.0,4.0,9.0,1.0,1.0,1696118400.0,1672444800.0,86400,2,53.87,53.93,53.345,54.125,53.87,53.93,53.345,54.125,1.56,0.0291,1696291200.0,0.5016,2.97,0.963,12.655661,12655677,12655677,17974387,14432020,14432020,0.0,0.0,1300,2900,217583796224,38.6,58.19,3.8173935,54.7554,50.7162,1.54,0.02858734,USD,200701673472.0,0.22128999,4051005668.0,4054860032.0,47865726.0,60493301.0,1693440000.0,1695945600.0,0.0117999995,0.0008,0.77446,2.82,0.0117999995,4054860032.0,10.908,4.9193254,1690588800.0,1722211200.0,1690588800.0,12613000192.0,3.07,4.24,2:1,953769600.0,3.521,11.656,0.32134938,0.19265866,0.39,1696291200.0,NMS,EQUITY,CSCO,"Cisco Systems, Inc.","Cisco Systems, Inc.",635178600,America/New_York,EDT,85fd1bb0-e226-3a6a-b3e9-b5dc1a4952f1,finmb_19691,-14400000,53.66,buy,26333999104.0,6.494,17219000320.0,9452000256.0,1.135,1.385,56997998592.0,21.311,13.926,0.09949,0.29986,35753000000.0,18073624576.0,19886000128.0,0.16,0.62727,0.3021,0.29442,USD,2.8255,17.478828,0.406,2.07,76.0,45.0,58.73,59.0,2.5,20.0,0.407,(408) 853-3683,
KO,One Coca-Cola Plaza,Atlanta,GA,30313,United States,404 676 2121,https://www.coca-colacompany.com,Beverages - Non-Alcoholic,beverages-non-alcoholic,Beverages - Non - Alcoholic,Consumer Defensive,consumer-defensive,Consumer Defensive,"The Coca-Cola Company, a beverage company, manufactures, markets, and sells various nonalcoholic beverages worldwide. The company provides sparkling soft drinks, sparkling flavors; water, sports, coffee, and tea; juice, value-added dairy, and plant-based beverages; and other beverages. It also offers beverage concentrates and syrups, as well as fountain syrups to fountain retailers, such as restaurants and convenience stores. The company sells its products under the Coca-Cola, Diet Coke/Coca-Cola Light, Coca-Cola Zero Sugar, Diet Coke, Cherry Coke, Fanta Orange, Fanta Zero Orange, Fanta Zero Sugar, Fanta Apple, Sprite, Sprite Zero Sugar, Simply Orange, Simply Apple, Simply Grapefruit, Fresca, Schweppes, Thums Up, Aquarius, Ayataka, BODYARMOR, Ciel, Costa, Dasani, dogadan, FUZE TEA, Georgia, glacéau smartwater, glacéau vitaminwater, Gold Peak, Ice Dew, I LOHAS, Powerade, Topo Chico, AdeS, Del Valle, fairlife, innocent, Minute Maid, and Minute Maid Pulpy brands. It operates through a network of independent bottling partners, distributors, wholesalers, and retailers, as well as through bottling and distribution operators. The company was founded in 1886 and is headquartered in Atlanta, Georgia.",82500.0,"[{'maxAge': 1, 'name': 'Mr. James Robert B. Quincey', 'age': 57, 'title': 'Chairman & CEO', 'yearBorn': 1965, 'fiscalYear': 2022, 'totalPay': 8199145, 'exercisedValue': 0, 'unexercisedValue': 45320588}, {'maxAge': 1, 'name': 'Mr. John  Murphy', 'age': 60, 'title': 'President & CFO', 'yearBorn': 1962, 'fiscalYear': 2022, 'totalPay': 3705118, 'exercisedValue': 5483873, 'unexercisedValue': 14905066}, {'maxAge': 1, 'name': 'Mr. Manuel Arroyo Prieto', 'age': 54, 'title': 'Chief Marketing Officer', 'yearBorn': 1968, 'fiscalYear': 2022, 'totalPay': 2968764, 'exercisedValue': 0, 'unexercisedValue': 3602025}, {'maxAge': 1, 'name': 'Mr. Mark  Randazza', 'age': 56, 'title': 'VP, Assistant Controller & Chief Accounting Officer', 'yearBorn': 1966, 'fiscalYear': 2022, 'exercisedValue': 0, 'unexercisedValue': 0}, {'maxAge': 1, 'name': 'Ms. Stacy Lynn  Apter', 'age': 55, 'title': 'VP of Corporate Finance & Treasurer', 'yearBorn': 1967, 'fiscalYear': 2022, 'exercisedValue': 0, 'unexercisedValue': 0}, {'maxAge': 1, 'name': 'Ms. Nancy W. Quan', 'age': 56, 'title': 'Senior VP and Chief Technical & Innovation Officer', 'yearBorn': 1966, 'fiscalYear': 2022, 'exercisedValue': 0, 'unexercisedValue': 0}, {'maxAge': 1, 'name': 'Mr. Neeraj  Tolmare', 'title': 'Global Chief Information Officer', 'fiscalYear': 2022, 'exercisedValue': 0, 'unexercisedValue': 0}, {'maxAge': 1, 'name': 'Ms. Robin  Halpern', 'title': 'VP & Global Head of Investor Relations', 'fiscalYear': 2022, 'exercisedValue': 0, 'unexercisedValue': 0}, {'maxAge': 1, 'name': 'Ms. Monica Howard Douglas', 'age': 49, 'title': 'Senior VP & General Counsel', 'yearBorn': 1973, 'fiscalYear': 2022, 'exercisedValue': 0, 'unexercisedValue': 0}, {'maxAge': 1, 'name': 'Ms. Beatriz R. Perez', 'age': 52, 'title': 'Senior VP & Global Chief of Communications, Sustainability and Strategic Partnerships Officer', 'yearBorn': 1970, 'fiscalYear': 2022, 'exercisedValue': 0, 'unexercisedValue': 0}]",7.0,8.0,3.0,4.0,5.0,1696118400.0,1672444800.0,86400,2,54.03,54.22,53.02,54.28,54.03,54.22,53.02,54.28,1.84,0.0343,1694649600.0,0.7469,3.05,0.597,19.182142,20925276,20925276,12958381,18015800,18015800,0.0,0.0,1100,1200,232260304896,51.55,64.99,5.261901,58.4808,60.7016,1.8,0.033314824,USD,261300551680.0,0.23811,3893423851.0,4324340224.0,23040297.0,22869361.0,1693440000.0,1695945600.0,0.0053,0.00666,0.71533996,1.55,0.0054,4324340224.0,6.016,8.927859,1672444800.0,1703980800.0,1688083200.0,10510000128.0,2.41,2.8,2:1,1344816000.0,5.92,18.929,-0.038661182,0.19265866,0.46,1694649600.0,NYQ,EQUITY,KO,Coca-Cola Company (The),The Coca-Cola Company,-252322200,America/New_York,EDT,5fed318f-9c85-3ad1-b311-20392472c25a,finmb_26642,-14400000,53.71,buy,15694000128.0,3.629,13804000256.0,43194998784.0,0.815,1.144,44139999232.0,156.776,10.206,0.08234,0.40157002,25004000000.0,9308375040.0,11100999680.0,0.057,0.58523,0.31273,0.31306,USD,2.4909,22.286306,0.337,3.36,76.0,60.0,69.14,70.0,2.0,21.0,0.339,,
DOW,2211 H.H. Dow Way,Midland,MI,48674,United States,989 636 1000,https://www.dow.com,Chemicals,chemicals,Chemicals,Basic Materials,basic-materials,Basic Materials,"Dow Inc., through its subsidiaries, engages in the provision of various materials science solutions for packaging, infrastructure, mobility, and consumer applications in the United States, Canada, Europe, the Middle East, Africa, India, the Asia Pacific, and Latin America. It operates through Packaging & Specialty Plastics, Industrial Intermediates & Infrastructure, and Performance Materials & Coatings segments. The Packaging & Specialty Plastics segment provides ethylene, and propylene and aromatics products; and polyethylene, polyolefin elastomers, ethylene vinyl acetate, and ethylene propylene diene monomer rubbers for mobility and transportation, consumer, wire and cable, and construction end-markets. The Industrial Intermediates & Infrastructure segment offers purified ethylene and propylene oxides, ethylene and ethanol amines, propylene glycol and polyether polyols, aromatic isocyanates and polyurethane systems, coatings, adhesives, sealants, elastomers, and composites. This segment also provides caustic soda, and ethylene dichloride and vinyl chloride monomers; and cellulose ethers, redispersible latex powders, and acrylic emulsions. The Performance Materials and Coatings segment provides architectural paints and coatings, and industrial coatings that are used in maintenance and protective industries, wood, metal packaging, traffic markings, thermal paper, and leather; and silicon metal, siloxanes, and intermediates used as key materials in manufacturing differentiated downstream silicone products. It also engages in property and casualty insurance, as well as reinsurance business. Dow Inc. was incorporated in 2018 and is headquartered in Midland, Michigan.",37800.0,"[{'maxAge': 1, 'name': 'Mr. James R. Fitterling', 'age': 60, 'title': 'Chairman & CEO', 'yearBorn': 1962, 'fiscalYear': 2022, 'totalPay': 5366657, 'exercisedValue': 0, 'unexercisedValue': 1118801}, {'maxAge': 1, 'name': 'Mr. Howard I. Ungerleider', 'age': 54, 'title': 'Pres & CFO', 'yearBorn': 1968, 'fiscalYear': 2022, 'totalPay': 3215963, 'exercisedValue': 3760982, 'unexercisedValue': 926072}, {'maxAge': 1, 'name': 'Dr. Attiganal Narayanaswam Sreeram', 'age': 54, 'title': 'Sr. VP of R&D and Chief Technology Officer', 'yearBorn': 1968, 'fiscalYear': 2022, 'totalPay': 1863569, 'exercisedValue': 1424135, 'unexercisedValue': 0}, {'maxAge': 1, 'name': 'Ms. Karen S. Carter', 'age': 50, 'title': 'Pres of Packaging & Specialty Plastics', 'yearBorn': 1972, 'fiscalYear': 2022, 'totalPay': 1594879, 'exercisedValue': 0, 'unexercisedValue': 94607}, {'maxAge': 1, 'name': 'Ms. Jane M. Palmieri', 'age': 53, 'title': 'Pres of Industrial Intermediates & Infrastructure - Asia Pacific oversight', 'yearBorn': 1969, 'fiscalYear': 2022, 'totalPay': 1432019, 'exercisedValue': 0, 'unexercisedValue': 359031}, {'maxAge': 1, 'name': 'Mr. John Maurice Sampson', 'age': 61, 'title': 'Sr. VP of Operations, Manufacturing & Engineering', 'yearBorn': 1961, 'fiscalYear': 2021, 'exercisedValue': 0, 'unexercisedValue': 0}, {'maxAge': 1, 'name': 'Ms. Melanie  Kalmar', 'title': 'Corp. VP, Chief Information Officer & Chief Digital Officer', 'exercisedValue': 0, 'unexercisedValue': 0}, {'maxAge': 1, 'name': 'Mr. Pankaj  Gupta', 'title': 'VP of Investor Relations', 'exercisedValue': 0, 'unexercisedValue': 0}, {'maxAge': 1, 'name': 'Ms. Amy E. Wilson', 'age': 51, 'title': 'Gen. Counsel & Corp. Sec.', 'yearBorn': 1971, 'fiscalYear': 2021, 'exercisedValue': 0, 'unexercisedValue': 0}, {'maxAge': 1, 'name': 'Mr. Torsten  Kraef', 'age': 55, 'title': 'Sr. VP of Corp. Devel.', 'yearBorn': 1967, 'exercisedValue': 0, 'unexercisedValue': 0}]",1.0,6.0,2.0,5.0,2.0,1696118400.0,1672444800.0,86400,2,51.31,51.1,50.51,51.51,51.31,51.1,50.51,51.51,2.8,0.0546,1693353600.0,1.1429,,1.322791,13.392105,3048353,3048353,4288753,4146430,4146430,0.0,0.0,800,1400,35779485696,42.91,60.875,0.7265608,53.2312,54.12775,2.8,0.054570258,USD,49249755136.0,0.03541,701717623.0,703075008.0,11816945.0,11235254.0,1693440000.0,1695945600.0,0.0168,0.00125,0.65708,2.91,0.0168,703075008.0,28.442,1.7892554,1672444800.0,1703980800.0,1688083200.0,1731000064.0,2.47,3.8,,,1.0,8.134,0.10823166,0.19265866,0.7,1693353600.0,NYQ,EQUITY,DOW,Dow Inc.,Dow Inc.,1553088600,America/New_York,EDT,9510e206-86db-3ea5-bd8f-fbd901232728,finmb_9830660,-14400000,50.89,hold,3640999936.0,5.179,6055000064.0,16304000000.0,0.953,1.922,49244999680.0,79.497,69.388,0.03649,0.091709994,8564000000.0,2972124928.0,5900000256.0,-0.271,0.11942001,0.122959994,0.0714,USD,3.5565,20.60324,-0.708,-2.74,66.0,47.0,55.58,55.0,2.8,19.0,-0.699,989 832 1456,
XOM,5959 Las Colinas Boulevard,Irving,TX,75039-2298,United States,972 940 6000,https://corporate.exxonmobil.com,Oil & Gas Integrated,oil-gas-integrated,Oil & Gas Integrated,Energy,energy,Energy,"Exxon Mobil Corporation engages in the exploration and production of crude oil and natural gas in the United States and internationally. It operates through Upstream, Energy Products, Chemical Products, and Specialty Products segments. The Upstream segment explores for and produces crude oil and natural gas. The Energy Products segment offers fuels, aromatics, and catalysts, as well as licensing services. The Chemical Products segment manufactures and markets petrochemicals including olefins, polyolefins, and intermediates. The Specialty Products segment offers performance products, including lubricants, basestocks, waxes, synthetics, elastomers, and resins. The company is involved in the manufacturing, trade, transport, and sale of crude oil, natural gas, petroleum products, petrochemicals, and other specialty products; and pursuit lower-emission business opportunities including carbon capture and storage, hydrogen, and lower-emission fuels. Exxon Mobil Corporation was founded in 1870 and is headquartered in Irving, Texas.",62000.0,"[{'maxAge': 1, 'name': 'Mr. Darren W. Woods', 'age': 57, 'title': 'Chairman of the Board, President & CEO', 'yearBorn': 1965, 'fiscalYear': 2022, 'totalPay': 8463868, 'exercisedValue': 0, 'unexercisedValue': 0}, {'maxAge': 1, 'name': 'Ms. Kathryn A. Mikells', 'age': 56, 'title': 'Senior VP & CFO', 'yearBorn': 1966, 'fiscalYear': 2022, 'totalPay': 5567842, 'exercisedValue': 0, 'unexercisedValue': 0}, {'maxAge': 1, 'name': 'Mr. Neil A. Chapman', 'age': 60, 'title': 'Senior Vice President', 'yearBorn': 1962, 'fiscalYear': 2022, 'totalPay': 5248653, 'exercisedValue': 0, 'unexercisedValue': 0}, {'maxAge': 1, 'name': 'Mr. Jack P. Williams Jr.', 'age': 58, 'title': 'Senior Vice President', 'yearBorn': 1964, 'fiscalYear': 2022, 'totalPay': 5400331, 'exercisedValue': 0, 'unexercisedValue': 0}, {'maxAge': 1, 'name': 'Ms. Karen T. McKee', 'age': 54, 'title': 'VP & President of ExxonMobil Product Solutions Company', 'yearBorn': 1968, 'fiscalYear': 2022, 'totalPay': 4605436, 'exercisedValue': 0, 'unexercisedValue': 0}, {'maxAge': 1, 'name': 'Mr. Leonard M. Fox', 'age': 58, 'title': 'VP, Principal Accounting Officer & Controller', 'yearBorn': 1964, 'fiscalYear': 2022, 'exercisedValue': 0, 'unexercisedValue': 0}, {'maxAge': 1, 'name': 'Ms. Jennifer K. Driscoll', 'age': 56, 'title': 'Vice President of Investor Relations', 'yearBorn': 1966, 'fiscalYear': 2022, 'exercisedValue': 0, 'unexercisedValue': 0}, {'maxAge': 1, 'name': 'Mr. Craig S. Morford', 'age': 63, 'title': 'VP, Secretary & General Counsel', 'yearBorn': 1959, 'fiscalYear': 2022, 'exercisedValue': 0, 'unexercisedValue': 0}, {'maxAge': 1, 'name': 'Ms. Suzanne M. McCarron', 'title': 'Vice President of Public & Government Affairs', 'fiscalYear': 2022, 'exercisedValue': 0, 'unexercisedValue': 0}, {'maxAge': 1, 'name': 'Ms. Tracey C. Gunnlaugsson', 'title': 'Vice President of Human Resources', 'fiscalYear': 2022, 'exercisedValue': 0, 'unexercisedValue': 0}]",10.0,7.0,8.0,1.0,7.0,1696118400.0,1672444800.0,86400,2,110.45,106.96,104.83,107.17,110.45,106.96,104.83,107.17,3.64,0.0342,1692057600.0,0.2888,5.27,1.044,11.740904,57705726,57705726,16770264,22260410,22260410,0.0,0.0,800,800,424522383360,97.4,120.7,1.1536655,112.062,109.83205,3.61,0.03268447,USD,446218993664.0,0.14055,3997268062.0,3986500096.0,44433891.0,38314422.0,1693440000.0,1695945600.0,0.0111,0.00061,0.60717,2.84,0.0112,3986500096.0,49.722,2.141708,1672444800.0,1703980800.0,1688083200.0,51719999488.0,12.5,9.07,2:1,995500800.0,1.213,5.638,0.045351863,0.19265866,0.91,1692057600.0,NYQ,EQUITY,XOM,Exxon Mobil Corporation,Exxon Mobil Corporation,-252322200,America/New_York,EDT,623c29c3-4307-34c2-840f-d89284dd4857,finmb_406338,-14400000,106.49,buy,29528000512.0,7.376,79138996224.0,41495998464.0,1.059,1.484,367977005056.0,20.047,89.25,0.10511,0.27201998,133715000000.0,32003000320.0,67769999360.0,-0.272,0.34379002,0.21507,0.12907,USD,,8.519199,-0.559,-1.18,150.0,110.0,125.73,121.5,2.4,22.0,-0.54,,
GS,200 West Street,New York,NY,10282,United States,212 902 1000,https://www.goldmansachs.com,Capital Markets,capital-markets,Capital Markets,Financial Services,financial-services,Financial Services,"The Goldman Sachs Group, Inc., a financial institution, provides a range of financial services for corporations, financial institutions, governments, and individuals worldwide. It operates through Global Banking & Markets, Asset & Wealth Management, and Platform Solutions segments. The Global Banking & Markets segment provides financial advisory services, including strategic advisory assignments related to mergers and acquisitions, divestitures, corporate defense activities, restructurings, and spin-offs; and relationship lending, and acquisition financing, as well as secured lending, through structured credit and asset-backed lending and involved in resale agreements. This segment also offers client execution activities for cash and derivative instruments; credit and interest rate products; and provision of mortgages, currencies, commodities, and equities related products, as well as underwriting services. The Asset & Wealth Management segment manages assets across various classes, including equity, fixed income, hedge funds, credit funds, private equity, real estate, currencies, and commodities; and provides customized investment advisory solutions, wealth advisory services, personalized financial planning, and private banking services, as well as invests in corporate equity, credit, real estate, and infrastructure assets. The Platform Solutions segment offers credit cards and point-of-sale financing for purchase of goods or services. This segment also provides cash management services, such as deposit-taking and payment solutions for corporate and institutional clients. The Goldman Sachs Group, Inc. was founded in 1869 and is headquartered in New York, New York.",44600.0,"[{'maxAge': 1, 'name': 'Mr. David  Solomon', 'age': 60, 'title': 'Chairman & CEO', 'yearBorn': 1962, 'fiscalYear': 2022, 'totalPay': 9205077, 'exercisedValue': 0, 'unexercisedValue': 0}, {'maxAge': 1, 'name': 'Mr. John E. Waldron', 'age': 52, 'title': 'President & COO', 'yearBorn': 1970, 'fiscalYear': 2022, 'totalPay': 10853897, 'exercisedValue': 0, 'unexercisedValue': 0}, {'maxAge': 1, 'name': 'Mr. Denis P. Coleman III', 'age': 47, 'title': 'Chief Financial Officer', 'yearBorn': 1975, 'fiscalYear': 2022, 'totalPay': 9068036, 'exercisedValue': 0, 'unexercisedValue': 0}, {'maxAge': 1, 'name': 'Ms. Kathryn H. Ruemmler', 'age': 50, 'title': 'Chief Legal Officer, Secretary & General Counsel', 'yearBorn': 1972, 'fiscalYear': 2022, 'totalPay': 5768577, 'exercisedValue': 0, 'unexercisedValue': 0}, {'maxAge': 1, 'name': 'Mr. Philip R. Berlinski', 'age': 45, 'title': 'Global Treasurer', 'yearBorn': 1977, 'fiscalYear': 2022, 'totalPay': 9548229, 'exercisedValue': 0, 'unexercisedValue': 0}, {'maxAge': 1, 'name': 'Mr. J. D. Gardner', 'title': 'Director', 'fiscalYear': 2022, 'exercisedValue': 0, 'unexercisedValue': 0}, {'maxAge': 1, 'name': 'Ms. Sheara J. Fredman', 'age': 46, 'title': 'Controller & Chief Accounting Officer', 'yearBorn': 1976, 'fiscalYear': 2022, 'exercisedValue': 0, 'unexercisedValue': 0}, {'maxAge': 1, 'name': 'F. X. De Mallmann', 'title': 'Chair of Investment Banking', 'fiscalYear': 2022, 'exercisedValue': 0, 'unexercisedValue': 0}, {'maxAge': 1, 'name': 'Mr. Atte  Lahtiranta', 'title': 'Partner & Chief Technology Officer', 'fiscalYear': 2022, 'exercisedValue': 0, 'unexercisedValue': 0}, {'maxAge': 1, 'name': 'Mr. Marco  Argenti', 'title': 'Partner & Chief Information Officer', 'fiscalYear': 2022, 'exercisedValue': 0, 'unexercisedValue': 0}]",5.0,6.0,5.0,6.0,6.0,1696118400.0,1672444800.0,86400,2,314.77,315.43,311.6,316.63,314.77,315.43,311.6,316.63,11.0,0.035099998,1693353600.0,0.4255,2.11,1.424,8.9845,1615022,1615022,1942189,1622790,1622790,0.0,0.0,1100,1300,103193616384,287.75,389.58,2.358388,329.043,336.1306,10.0,0.03176923,USD,-210370723840.0,0.20214,344933238.0,329671008.0,3198171.0,3245282.0,1693440000.0,1695945600.0,0.0097,0.0054900004,0.71412003,1.91,0.0097,329671008.0,303.873,1.0301014,1672444800.0,1703980800.0,1688083200.0,8253000192.0,23.51,34.84,,,-4.808,,0.019376636,0.19265866,2.75,1693353600.0,NYQ,EQUITY,GS,"Goldman Sachs Group, Inc. (The)","The Goldman Sachs Group, Inc.",925824600,America/New_York,EDT,71a75a16-7c33-358b-bb56-1764255c880a,finmb_398625,-14400000,313.02,buy,968569978880.0,2791.285,,638347968512.0,1.535,1.642,43755999232.0,545.485,125.826,0.00558,0.075040005,37530000000.0,,24152999936.0,-0.082,0.83022004,0.0,0.26693,USD,2.4133,13.314334,-0.585,1.43,450.0,305.0,380.78,387.0,2.3,25.0,-0.601,,
